ID,Handle,Title,DescriptionHTML
gid://shopify/Collection/657057055044,fertilizante-de-frass-de-insecto-frassor,Fertilizante de Frass de Insecto Frassor,"<p>Frassor Insect Frass es un fertilizante orgánico para todas las plantas: céspedes, huertos, jardines ornamentales y cultivos profesionales. Los gránulos de fertilizante Frassor se producen a partir de frass 100% puro (excremento de insecto) obtenido de las larvas de la mosca soldado negra. Un producto de calidad holandesa, se seca e higieniza mediante calor y luego se comprime en un gránulo único.<br><h2>Fuente de nutrientes esenciales</h2><br>Estos gránulos de fertilizante Frassor tienen un NPK de 3-3-3 y un alto contenido de quitina. Además, el producto es rico en minerales, oligoelementos y materia orgánica. Este fertilizante universal contiene todos los nutrientes necesarios tanto para el césped como para las plantas. Siendo 100% orgánicos, los nutrientes se liberan de manera controlada y no se lixivian. Alimentar con Frassor mejora los rendimientos y la calidad del crecimiento, la floración y la resiliencia de las plantas y el suelo.<br><h2>Frass</h2><br>El frass es el excremento de insectos herbívoros. El frass de insecto en este producto proviene de las larvas de la mosca soldado negra. Los insectos se alimentan con corrientes residuales vegetales de bajo valor, que se transforman en proteínas y grasas de alta calidad. Frassor enriquece y procesa el frass en fertilizantes naturales de alta calidad.<br><h2>Nutre la vida del suelo</h2><br>Una vida saludable del suelo comienza con los insectos. Estas criaturas eficientes mantienen un equilibrio ecológico en la naturaleza. Los residuos dejados por los insectos, como excrementos y mudas de piel, son ricos en quitina y se utilizan como materia prima para Frassor. Este fertilizante orgánico asegura que el agua y los nutrientes del suelo se retengan, haciéndolos disponibles en el suelo durante un período más largo. El resultado es un suelo más saludable con suficientes nutrientes disponibles incluso durante períodos más secos. La quitina sirve como fuente de alimento para los organismos benéficos del suelo y apoya la resiliencia de las plantas y el suelo.<br><h2>Quitina: Estimula la actividad antagónica, resultando en una mayor resiliencia de plantas y suelo</h2><br>Frassor es muy abundante en quitina. La quitina sirve como superalimento para los microorganismos que la descomponen. Durante este proceso, se liberan enzimas (quitasas) que desencadenan en la planta la activación de sus mecanismos de defensa naturales. Como resultado, el cultivo se vuelve menos atractivo para enfermedades y plagas. No es de extrañar que Frassor se aplique con éxito en el sector de la horticultura.<br><h2>Lo mejor para el medio ambiente</h2><br>¡Frassor tiene la huella de CO2 más baja entre todos los fertilizantes! La producción de fertilizantes artificiales consume mucha energía, lo que conduce a emisiones significativas de CO2. Además, los fertilizantes artificiales tienen un impacto negativo en toda la vida en el suelo y se lixivian rápidamente. Comparado con otros fertilizantes orgánicos como el estiércol de vaca, pollo y cerdo, el frass de insecto Frassor tiene una huella de CO2 considerablemente más baja. También supera a otros en términos de otros aspectos ambientales, como el uso de la tierra y el consumo de agua.<br><div id=""gtx-trans"" style=""position: absolute;left: 182px;top: 1245.25px""><br><div class=""gtx-trans-icon""></div><br></div></p>"
gid://shopify/Collection/657057087812,herramientas,Herramientas,"<p>Pulverizadores de presión profesionales, nebulizadores y esparcidores para la aplicación rápida, eficiente y precisa de fertilizantes, potenciadores de plantas y mejoradores de suelo.</p>"
gid://shopify/Collection/657057186116,fertilizante-de-lombrices-vermicompost,Fertilizante de lombrices Vermicompost,"<p>El vermicompost, también conocido como humus de lombriz, es un poderoso y natural mejorador de suelos que enriquece la tierra con microorganismos esenciales, incluyendo bacterias y hongos. Estos microorganismos ayudan a descomponer la materia orgánica y estimulan el crecimiento de las plantas. Además, la composición única del estiércol de lombriz asegura una absorción óptima de nutrientes por parte de las plantas, haciéndolas más fuertes y saludables. La estructura del suelo mejorada por el humus de lombriz permite que las raíces de las plantas crezcan más profundas y amplias, lo que lleva a una mejor absorción de agua y nutrientes. El vermicompost también es rico en enzimas, con aproximadamente 2 mil millones de enzimas por gramo, lo que mejora aún más la absorción de nutrientes por las plantas. Además, promueve la resistencia natural de las plantas contra enfermedades y hongos. Además, el uso de humus de lombriz asegura una germinación más rápida de las semillas, hace que el trasplante sea más suave y acelera la cosecha. En resumen, el humus de lombriz es un mejorador de suelos esencial para cualquiera que aspire a un jardín saludable, vibrante y sostenible.</p>"
gid://shopify/Collection/657057251652,mezcla-de-cubierta-superior-para-cesped,Mezcla de Cubierta Superior para Césped,"<p>Esta Mezcla de Cubierta Superior para Césped con hongos y bacterias vivas (incluyendo hongos micorrízicos y especies de Bacillus) estimula y activa la vida del suelo. La cubierta superior definitiva se basa en una mezcla de vermicompost y estiércol de vaca seco, enriquecida con minerales y elementos traza de harina de lava.</p>
<p>¡Un suelo fértil está vivo!<br>Organifer nutre el suelo y estimula una vida positiva del mismo. Esta Mezcla de Cubierta Superior para Césped restaura el suelo y previene problemas. La vida del suelo proporciona un amortiguamiento de nutrientes, haciéndolos disponibles cuando el césped los necesita. Al activar e introducir una vida del suelo activa, no solo se alimenta el césped, sino también el suelo.</p>
<p>El césped vive en simbiosis con hongos y bacterias<br>Con esta Mezcla de Cubierta Superior para Césped, se introducen y activan, entre otros, hongos Mychorizza y Rhizobacterias vivos. La vida positiva del suelo, como los gusanos y hongos, forman túneles en el suelo, permitiendo que el aire, el material orgánico y otros nutrientes se distribuyan a través del suelo. Los materiales vegetales muertos son procesados en materia prima nutritiva por compostadores. Esta mezcla se utiliza con éxito en la práctica para estimular una vida saludable del suelo. Especialmente en el área alrededor de las raíces de las plantas, la llamada rizosfera, viven millones de hongos y bacterias, intercambiando nutrientes entre sí y con las plantas, mejorando mutuamente sus vidas.</p>
<p>La micro-vida positiva sirve a la planta, que a su vez ofrece azúcares. Una vida saludable del suelo contiene miles de diferentes bacterias, hongos y enzimas que cooperan de cierta manera para beneficio mutuo. Ciertas bacterias neutralizan sustancias peligrosas como metales pesados. La bacteria Azotobacter añadida extrae nitrógeno del aire e intercambia azúcares con la planta. Otros microorganismos descomponen material vegetal muerto y lo convierten en nutrientes absorbibles. Algunos atacan patógenos, mientras que hongos importantes ayudan a extraer nutrientes más profundos del suelo. Las bacterias Bacillus añadidas promueven el crecimiento de las raíces y aumentan la resistencia a los patógenos. En resumen, ¡el suelo está vivo! Un ecosistema saludable es crucial. La Mezcla de Cubierta Superior para Césped equilibra el suelo, apoya una vida positiva del suelo y aumenta la resistencia de las plantas y el suelo. En un suelo saludable crecen plantas saludables, sin espacio para enfermedades y plagas.</p>
<p>Harina de lava<br>Muchos suelos tienen escasez de minerales y elementos traza, causando que los procesos en el suelo y las plantas no funcionen de manera óptima. Esta Mezcla de Cubierta Superior para Césped está enriquecida con harina de lava Organifer de alta calidad, que reabastece minerales y elementos traza esenciales. Esto hace que el suelo sea naturalmente más fértil.</p>
<p>Vermicompost<br>El vermicompost de Organifer se considera de lo mejor. Es un mejorador natural basado en residuos de plantas compostadas, proporcionando un equilibrio óptimo en el suelo para que la planta crezca y florezca. El vermicompost contiene todo lo que una planta realmente necesita: un contenido orgánico muy alto (humus) y una multitud de elementos traza, enzimas, minerales, bacterias y hongos. Un suelo rico en humus retiene mejor los nutrientes. Combinado con vermicompost, las bacterias y hongos pueden prosperar y la estructura del suelo mejorará considerablemente.</p>
<p>Nutrición para un césped saludable y vital<br>Al mezclar estiércol de vaca seco, no solo se mejora el suelo, sino que también se proporciona nutrición inmediatamente disponible. Este fertilizante orgánico tiene un efecto duradero. El fertilizante nutre el suelo y asegura un suelo rico y saludable. Esto promueve un crecimiento equilibrado y le da al césped una buena estructura. Un fertilizante orgánico es una fuente de energía para las bacterias y se convierte en humus. El humus proporciona una buena estructura del suelo y promueve procesos naturales. La Mezcla de Cubierta Superior para Césped asegura una vida del suelo activa y una estructura óptima del suelo, resultando en un césped saludable y vital.</p>"
gid://shopify/Collection/657057284420,microtrebol,Microtrébol,"<p>Certificado como el mejor trébol del mercado, el Microtrébol de Organifer es una variedad de trébol blanco de hojas pequeñas y duraderas que se puede integrar sin esfuerzo en mezclas de semillas de césped para obtener un césped sin interrupciones y estéticamente valioso. Esta planta notable enriquece naturalmente el suelo fijando nitrógeno del aire, reduciendo la necesidad de fertilizante y proporcionando un césped verde y exuberante durante todo el año, incluso durante períodos de sequía.</p>"
gid://shopify/Collection/657057317188,concentrado-liquido-de-yuca-para-retener-la-humedad-del-suelo,Concentrado líquido de yuca - Para retener la humedad del suelo,"<p>El Agente Humectante de Yuca optimiza el equilibrio de humedad en el suelo y mejora las condiciones de crecimiento de las plantas, incluso en entornos secos y desafiantes. Yucca schidigera (Daga Española) contiene agentes humectantes naturales que ayudan a las plantas a retener la humedad y protegerse contra el estrés gracias a su alto contenido de saponinas esteroidales (mín. 10%). Esto lo hace ideal para áreas con disponibilidad limitada de agua, mejorando la retención de humedad en el suelo y promoviendo plantas más saludables y productivas. El Agente Humectante de Yuca mejora el crecimiento de bacterias beneficiosas en el suelo que descomponen el material orgánico y liberan nutrientes para las plantas. Aumenta la eficiencia de los productos de protección de cultivos y fertilizantes a través de una mejor absorción, reduciendo así la necesidad de estos productos. Las saponinas reducen la tensión superficial del agua, asegurando una mejor regulación de la humedad, enraizamiento y cobertura de las hojas, lo que resulta en raíces más fuertes y plantas más saludables. El Agente Humectante de Yuca es adecuado para campos de golf, campos deportivos, céspedes, bordes, jardines ornamentales, agricultura y huertos. El producto es completamente natural, seguro para plantas, animales y humanos, y se puede usar durante todo el año. Elija el Agente Humectante de Yuca de Organifer para obtener resultados óptimos, incluso durante períodos más secos.</p>"
gid://shopify/Collection/657057349956,fertilizante-profesional-para-cesped-y-cesped,Fertilizante profesional para césped y césped,"<p>El Fertilizante Pro Turf &amp; Lawn está especialmente diseñado para grandes céspedes exigentes, campos deportivos y campos de golf. Este fertilizante mineral 20+5+8 (+4+9) proporciona una nutrición duradera y eficiente mediante la liberación gradual de nitrógeno. Esto previene los brotes de crecimiento repentino y reduce la pérdida de agua y la formación de paja. Contiene nitrógeno amoniacal, magnesio e hierro, que promueven un color verde fuerte y previenen la formación de musgo. El producto es un granulado fino sin polvo (1-3 mm) que se disuelve con mínima precipitación y se puede aplicar manualmente o con un esparcidor mecánico.</p>"
gid://shopify/Collection/657057382724,cultivo-de-cobertura,Cultivo de cobertura,"<p>Nuestras versátiles mezclas de abono verde están diseñadas para apoyar la vida del suelo y aumentar la población de microorganismos beneficiosos. Con una diversa selección de familias de plantas, estas mezclas ayudan a suprimir el crecimiento de malezas, reducir las enfermedades transmitidas por el suelo y promover una estructura de suelo saludable. Ideales como cultivos de cobertura, mejoran el contenido de materia orgánica, optimizan la infiltración de agua y brindan protección contra la erosión del suelo. Al fomentar la biodiversidad, contribuyen a un ecosistema variado y mejoran la fertilidad del suelo, lo que lleva a rendimientos de cultivos más altos y resilientes. Adecuado para su uso en todo tipo de suelos.</p>"
gid://shopify/Collection/657057415492,bulbos-de-flor,Bulbos de flor,"<p>Los bulbos de flores se cultivan y seleccionan meticulosamente en los Países Bajos para garantizar la más alta calidad. Estos bulbos, que también se utilizan en jardines prestigiosos como 'de Keukenhof,' están entre los más grandes y potentes disponibles. Los bulbos de tulipán en variedades vibrantes, los elegantes bulbos de narciso, los llamativos Muscari Armeniacum y los especiales bulbos de Allium Purple Sensation aseguran una floración rica y prolongada en el jardín. Los bulbos de crocus también brindan una floración temprana y colorida en primavera. Con estos bulbos de calidad, el jardín se transforma en un paraíso colorido y floreciente en cada estación.</p>"
gid://shopify/Collection/657057481028,pienso,Pienso,"<p>Cuida de los pájaros, ardillas y erizos de tu jardín con nuestra selección especial de alimentos. Nuestra mezcla para pájaros ofrece un extra especial y, gracias a su fórmula que evita el crecimiento de semillas, previene el crecimiento indeseado en tu jardín. Para las ardillas, ofrecemos alimentos nutritivos y ricos en energía, y para los erizos, una fórmula equilibrada diseñada específicamente para sus necesidades.</p>
<p>Todos nuestros productos son 100% respetuosos con el medio ambiente y están libres de aditivos nocivos. De esta manera, puedes apoyar fácilmente y de manera responsable a los animales de tu jardín, garantizando vitalidad y equilibrio en tu espacio verde.</p>"
gid://shopify/Collection/657057612100,semillas-de-patatas-cebollas-y-chalotes,"Semillas de patatas, cebollas y chalotes","<p>Bienvenido a Nuestra Selección de Patatas de Siembra, Cebollas y Chalotes</p>
<p>El material de partida adecuado es esencial para un buen cultivo y un rendimiento óptimo. Nuestras patatas de siembra y cebollas para plantar han sido especialmente desarrolladas para el cultivo profesional y cumplen con los más altos estándares de calidad. También ofrecemos estos productos en paquetes más pequeños, haciendo que el mejor material de partida sea accesible para pequeños cultivadores.</p>
<p>&nbsp;</p>
<p>Todas nuestras patatas de siembra, incluidas variedades populares como Bintje, Frieslander y Annabelle, así como nuestros materiales de plantación, cuentan con la certificación NAK en los Países Bajos. Esto garantiza que puedes confiar en la más alta calidad para el rendimiento de tus cultivos. Descubre nuestras diferentes variedades adaptadas a diversos climas y tipos de suelo.</p>
<p>&nbsp;</p>
<p>Para los jardineros orgánicos, contamos con una amplia gama de patatas de siembra orgánicas, todas con certificación SKAL. Esta gama incluye desde patatas de siembra orgánicas hasta chalotes orgánicos, perfectos para un cultivo sostenible.</p>"
gid://shopify/Collection/657057644868,semilla,Semilla,"<p>Las mezclas de semillas de Organifer consisten en variedades con certificación NAK (Servicio General de Inspección de Semillas Agrícolas y Papas Semilleras de los Países Bajos). Esto proporciona certeza y garantía respecto a la composición y calidad de la mezcla. Esta etiqueta de calidad es una iniciativa de los criadores holandeses. Para lograr el máximo resultado de germinación, Organifer impone altos requisitos sobre la germinabilidad y especialmente sobre la calidad de la pureza. Te garantizamos el mejor material de inicio para un resultado perfecto.</p>
<p>Aquí están algunos de nuestros productos:</p>
<p>Semillas regenerativas para césped<br>Semillas para césped de juego<br>Semillas para césped ornamental<br>Semillas para césped de sombra<br>Semillas para pasto de pastura<br>Mezclas de semillas de flores<br>Semillas de verduras<br>Cada bolsa de semillas de Organifer es cuidadosamente seleccionada por su calidad y fiabilidad. Ya sea que busques embellecer tu césped o comenzar un jardín de verduras, nuestra selección de semillas ofrece una amplia variedad de opciones para cada jardinero. Y dado que están certificadas por NAK, puedes confiar en la pureza y la tasa de germinación de cada semilla. Comienza tu viaje de jardinería con las semillas de Organifer y observa cómo tus plantas florecen y tus cosechas prosperan.</p>"
gid://shopify/Collection/657058136388,fertilizante-para-cesped,Fertilizante para Césped,"<p>Los fertilizantes profesionales para césped están desarrollados para crear y mantener un césped verde profundo y saludable sin musgo ni malezas.</p>
<p>El Fertilizante para Césped Todo en Uno es un fertilizante orgánico-mineral de alta calidad adecuado para la fertilización de cualquier tipo de césped y suelo. Debido a la presencia de magnesio extra, cada césped se vuelve de un verde vibrante. Apto para nuevas instalaciones y fertilizaciones de mantenimiento. La combinación única de componentes de acción rápida y liberación lenta permite un inicio de crecimiento rápido junto con 100 días de nutrición completa. El Fertilizante para Césped Todo en Uno estimula positivamente la vida del suelo e incrementa la fertilidad natural del suelo con cada aplicación. El resultado es un césped denso y saludable sin espacio para musgo ni malezas.</p>
<p>El fertilizante de sulfato de hierro es un verdadero eliminador de musgo y proporciona un césped denso y verde exuberante sin musgo. El sulfato de hierro juega un papel crucial en la fotosíntesis de las plantas (de césped). El fertilizante asegura que las plantas absorban la luz solar de manera efectiva, aumentando su resistencia y previniendo fácilmente la aparición de enfermedades en las hojas.</p>
<p>La Renovación de Césped es la mezcla perfecta para transformar un césped débil y delgado en uno completo, fuerte y verde. La mezcla profesional para la reparación y regeneración del césped proporciona un césped verde denso y saludable dentro de un mes después de escarificar el césped. Los resultados y la conveniencia provienen de la combinación de semillas de césped de alta calidad, fertilizantes y un mejorador de suelo. Todo mezclado en la proporción óptima en una bolsa resistente, esta mezcla garantiza el éxito de un solo intento. No es de extrañar que la Renovación de Césped de Organifer haya sido utilizada con éxito por jardineros y consumidores exigentes durante años. Evita malezas, musgo y áreas desnudas; con la Renovación de Césped de Organifer, estás eligiendo un césped saludable, denso y de verde oscuro.</p>
<p>El Fertilizante de Otoño Todo en Uno es muy rico en potasio y proporciona protección extra contra el frío invierno para céspedes, hierba y plantas. El fertilizante aumenta la resistencia a los efectos directos de las heladas. La efectividad del fertilizante de otoño a menudo se subestima. Asegurando que el césped entre en el invierno fuerte y endurecido, se previenen problemas en la primavera.</p>"
gid://shopify/Collection/657058169156,abono-de-virutas-de-cuerno,Abono de Virutas de Cuerno,"<p>Los fertilizantes de cuerno, como las virutas de cuerno y la harina de cuerno, son fuentes 100 % naturales de nitrógeno: ideales para quienes eligen conscientemente una fertilización del jardín orgánica y sostenible. Estos abonos orgánicos están elaborados a partir de cuerno molido, un subproducto animal rico en nitrógeno (aproximadamente 14 % N), totalmente orgánico y de acción lenta. Como resultado, los nutrientes se liberan gradualmente durante un período de 6 a 12 semanas, lo que favorece un crecimiento vegetal constante sin riesgo de quemaduras ni lixiviación.</p>
<p>El fertilizante de cuerno es especialmente adecuado para cultivos exigentes en nitrógeno como coles, puerros, patatas, apio, árboles frutales y bayas, pero también funciona bien en plantas ornamentales, céspedes, parterres y compost. La textura gruesa o fina de las virutas y la harina de cuerno estimula la vida del suelo, favorece la formación de humus y contribuye a una estructura del suelo suelta y saludable. Gracias a su liberación lenta, es un fertilizante de base ideal en sistemas de cultivo orgánico y regenerativo.</p>
<p>Estos fertilizantes no tienen olor, son seguros de usar y están completamente libres de fertilizantes artificiales, aditivos sintéticos o residuos de compost, por lo que son aptos tanto para cultivadores profesionales como para jardineros aficionados exigentes. Elige fertilizante de cuerno como una solución sostenible para un aporte duradero de nitrógeno y una mejora activa del suelo.</p>"
gid://shopify/Collection/657058201924,setos-tejos-y-coniferas,"Setos, Tejos y Coníferas","<p>El fertilizante Todo en Uno para setos, tejos y coníferas ha sido especialmente desarrollado para mantener sus plantas perennes sanas, densas y vigorosas. Su composición equilibrada con NPK 5+4+6 y magnesio (+4) estimula el desarrollo de brotes fuertes, el crecimiento profundo de raíces y un color verde intenso en hojas y acículas.</p>
<p>El fertilizante actúa de forma inmediata y prolongada gracias a la combinación de nutrientes de disponibilidad rápida y liberación gradual. Además, su alto contenido en materia orgánica mejora la vida del suelo y favorece la estructura del mismo. Ideal tanto para nuevas plantaciones como para el mantenimiento de vegetación ya establecida. Para setos y coníferas sanos, compactos y resistentes, temporada tras temporada.</p>"
gid://shopify/Collection/657058234692,fertilizante-de-lana-de-oveja,Fertilizante de lana de oveja,"<p>Los pellets de lana de oveja son un fertilizante 100 % natural elaborado a partir de lana pura y recién esquilada. Con un contenido excepcionalmente alto de nitrógeno (10,5 %) y un efecto de liberación lenta natural que dura entre 8 y 10 meses, este fertilizante es ideal para cultivos vigorosos como coles, lechugas, puerros, tomates, patatas, árboles frutales y plantas ornamentales con flor.</p>
<p>Los pellets enriquecen el suelo con nitrógeno, potasio, azufre y magnesio de origen orgánico, y contribuyen activamente a la formación de humus, la aireación del suelo y una vida microbiana saludable. Gracias a su estructura fibrosa única, absorben hasta tres veces su propio peso en agua, lo que garantiza una retención de humedad estable y una protección eficaz contra la sequía.</p>
<p>Totalmente libres de fertilizantes químicos, residuos de compost, pesticidas y aditivos sintéticos. Apto para agricultura ecológica (cumple con la normativa ecológica de la UE y registrado en FiBL). Perfecto para huertos, jardines ornamentales, frutales, cultivos profesionales y plantas en maceta.</p>"
gid://shopify/Collection/657058267460,rosas-y-flores,Rosas y Flores,"<p>El fertilizante Todo en Uno para rosas y plantas de flor está especialmente formulado para promover un crecimiento vigoroso y una floración abundante. Con una composición equilibrada NPK 9+4+8, enriquecida con magnesio (+2), este fertilizante apoya cada etapa del crecimiento, desde brotes fuertes hasta flores de colores intensos.</p>
<p>Gracias a los nutrientes de acción rápida y liberación lenta, sus plantas se benefician de un suministro continuo de elementos esenciales. La materia orgánica añadida mejora la estructura del suelo y favorece la absorción de agua y nutrientes. Ideal para borduras, parterres, jardines ornamentales y plantas en maceta, para lograr plantas fuertes, más flores y un resultado verdaderamente espectacular.</p>"
gid://shopify/Collection/657058300228,acelerador-de-compost,Acelerador de compost,"<p>El Acelerador de Compost de Organifer es la solución ideal para quienes desean producir compost más rápidamente a partir de hojas, restos de jardín y desechos de cocina. Gracias a su potente combinación de sustancias orgánicas, magnesio y guano, se activan los microorganismos, acelerando y mejorando la eficiencia del proceso de compostaje.</p>
<p>Este acelerador de compost biológicamente activo favorece la formación de humus, regula el pH y estimula la vida del suelo. Incluso las hojas gruesas y los materiales de difícil descomposición se transforman en un compost valioso, sin olores y rico en nutrientes. Apto para montones de compost, compost de hojas y aplicación directa en el jardín, para un suelo más sano y plantas más fuertes.</p>"
