ID,Handle,Title,DescriptionHTML
gid://shopify/Collection/657058332996,frutas-verduras-y-hierbas,"Frutas, verduras y hierbas","<p>Este fertilizante todo en uno es la solución ideal tanto para el cultivo profesional como para la jardinería doméstica. Apto para una amplia gama de cultivos, como hortalizas, frutas, tomates y hierbas aromáticas. Su equilibrada composición proporciona a las plantas todos los nutrientes esenciales necesarios para un crecimiento óptimo, resultando en plantas más fuertes, mayores rendimientos y un sabor más intenso.</p>
<p>Gracias a su mezcla cuidadosamente formulada de componentes orgánicos y minerales, este fertilizante ofrece una potente fuente natural de nutrición que mejora la calidad del suelo y favorece el equilibrio natural del jardín. Esto crea un suelo sano y vital, perfecto para cultivar cultivos fuertes y productivos. El fertilizante acompaña a sus plantas en cada etapa de su crecimiento, desde el desarrollo radicular hasta la floración y la fructificación.</p>
<p>Este fertilizante fomenta un crecimiento uniforme, promueve una floración abundante y favorece la formación de frutos. El resultado es una cosecha más abundante de hortalizas, frutas y hierbas aromáticas que no solo produce más, sino que también tiene mejor sabor. Las plantas sanas también son más resistentes a enfermedades y factores de estrés como la sequía o las condiciones climáticas extremas, lo que garantiza una mayor vida útil y un resultado final más sabroso.</p>"
gid://shopify/Collection/657058398532,rododendro-hortensia-azalea-es,"Rododendro, hortensia, azalea","<p>Este fertilizante todo en uno está cuidadosamente formulado para plantas acidófilas como rododendros, hortensias, azaleas, camelias y brezos. La composición equilibrada con NPK 8+4+5(+2) y magnesio añadido favorece un fuerte desarrollo radicular, un follaje saludable y una floración abundante y prolongada.</p>
<p>Gracias a la combinación de nutrientes de acción rápida y liberación lenta, sus plantas reciben un soporte óptimo durante toda la temporada. La materia orgánica añadida mejora la vida del suelo, aumenta la retención de agua y estabiliza el pH de los suelos ácidos. Ideal para su uso en arriates, macetas o contenedores, garantizando plantas sanas, resistentes, de colores vibrantes y crecimiento vigoroso.</p>"
gid://shopify/Collection/657058431300,patentkali-potasio-magnesio,Patentkali Potasio Magnesio,"<p>Patentkali Kalimagnesia es un fertilizante de potasio-magnesio de alta calidad con bajo contenido de cloruro, especialmente desarrollado para cultivos sensibles al cloro. Gracias a la rápida disponibilidad de potasio, magnesio y azufre, este fertilizante favorece un mejor desarrollo radicular, una mayor tolerancia a la sequía y una mejor acumulación de azúcares. Adecuado para hortalizas, frutas, patatas y cultivos especializados. Promueve la resistencia al invierno, fortalece las estructuras celulares y es ideal para sistemas de cultivo intensivo.</p>"
gid://shopify/Collection/657058464068,carbon-vegetal-biochar-a-base-de-plantas,Carbón Vegetal Biochar a Base de Plantas,"<p>Organifer Biochar es un mejorador del suelo orgánico de alta calidad, elaborado a partir de 100 % cáscaras de cacao mediante pirólisis sostenible. Este subproducto de la industria del cacao se reutiliza en un proceso circular que contribuye a reducir residuos y a fomentar una agricultura más saludable. Gracias a su estructura abierta y porosa, el Biochar ofrece una gran superficie para el almacenamiento de agua y nutrientes, lo que genera un entorno del suelo más estable y un crecimiento vegetal más vigoroso, incluso en condiciones de sequía.</p>
<p>El Biochar mejora la fertilidad del suelo al retener minerales, incrementa la capacidad de retención de agua y hace que el suelo sea más resistente frente a condiciones climáticas extremas. Además, regula los niveles de pH y favorece una vida microbiana saludable. Con una composición natural, libre de fertilizantes artificiales o aditivos, Organifer Biochar es seguro tanto para huertos domésticos como para cultivos agrícolas a gran escala.</p>"
gid://shopify/Collection/657058496836,fertilizante-de-sulfato-de-amonio-es,Fertilizante de Sulfato de Amonio,"<p>El fertilizante de sulfato de amonio es un potente fertilizante mineral que contiene un 21 % de nitrógeno amoniacal y un 60 % de azufre. Su fórmula de acción rápida estimula el crecimiento inmediato de las hojas, la formación de proteínas y la vitalidad de los cultivos. Gracias a su efecto acidificante natural, reduce el pH de los suelos calcáreos, mejorando la disponibilidad de oligoelementos como el hierro, el manganeso y el zinc.</p>
<p>Es ideal para cultivos con altas demandas de nitrógeno y azufre, como patatas, coles, cebollas, puerros, fresas y uvas. Gracias a sus gránulos finos y de fácil distribución, este fertilizante resulta sencillo de aplicar tanto para aficionados a la jardinería como para cultivadores profesionales.</p>"
gid://shopify/Collection/657058627908,semilla-de-cesped-resistente-a-la-sequia,Semilla de Césped Resistente a la Sequía,"<p>La semilla de césped resistente a la sequía garantiza un césped fuerte y resistente que se mantiene verde y saludable incluso durante los veranos calurosos y los periodos prolongados de sequía. Gracias a las variedades de césped de raíces profundas, el césped obtiene agua y nutrientes de capas más profundas del suelo, lo que lo hace menos dependiente del riego. El resultado es un césped de bajo mantenimiento que se recupera rápidamente tras el uso y soporta un alto nivel de pisoteo.</p>
<p>Con esta semilla de césped tolerante al calor y a la sequía, podrá crear un césped sostenible que se mantenga denso, robusto y con un color intenso temporada tras temporada. Ideal para jardines particulares, áreas de juego y campos deportivos donde el rendimiento y un aspecto verde intenso son esenciales, incluso bajo condiciones climáticas extremas.</p>"
gid://shopify/Collection/657058660676,semilla-de-cesped-para-praderas-paddock,Semilla de Césped para Praderas (Paddock),"<p>La Semilla de Césped para Praderas (Paddock) ha sido especialmente desarrollada para crear pastos duraderos y resistentes para caballos. Su mezcla de germinación rápida forma un césped denso y mullido que soporta sin problema el pastoreo intenso, las galopadas y el escarbar con las patas. Gracias a sus puntos de crecimiento bajos, el césped se recupera rápidamente, evitando la aparición de calvas y malas hierbas.</p>
<p>Esta mezcla de semillas, altamente palatable, produce un césped nutritivo y saludable, ideal para el pastoreo diario y completamente seguro para los caballos. Con la Semilla de Césped para Praderas (Paddock), creará un pasto fuerte y verde que garantiza un suministro constante de hierba y contribuye al bienestar y la salud de sus caballos.</p>"
gid://shopify/Collection/657058693444,semilla-de-cesped-para-heno-y-ensilado,Semilla de Césped para Heno y Ensilado,"<p>Organifer Hay es una mezcla de semillas de césped premium, especialmente desarrollada para la siega y la producción de heno y ensilado. Ofrece hasta un 30 % más de rendimiento por hectárea en comparación con las mezclas de heno estándar y forma un césped duradero que se mantiene productivo durante años.</p>
<p>Gracias a su composición equilibrada —que incluye fleo, festuca de los prados y dáctilo— produce un heno rico en fibra y aromático, con bajo contenido en fructanos. Esto convierte al forraje en una opción segura para caballos, reduciendo el riesgo de laminitis y sobrepeso. Los caballos lo consumen por completo con facilidad, mientras que su valor nutritivo constante favorece una digestión saludable.</p>
<p>Organifer Hay destaca por su alto valor alimenticio, su secado rápido tras la siega y su estabilidad a largo plazo. El resultado es un forraje de primera calidad, directamente de su propio terreno: palatable, seguro y productivo, temporada tras temporada.</p>"
gid://shopify/Collection/657058955588,fertilizante-para-sedum-y-cubiertas-verdes,Fertilizante para sedum y cubiertas verdes,"<p>Organifer Fertilizante para sedum y cubiertas verdes es un fertilizante organo-mineral especializado, diseñado para optimizar el crecimiento, la densidad y la vitalidad del sedum y de las cubiertas verdes. Esta categoría incluye productos desarrollados para mantener los tejados verdes exuberantes, fuertes y saludables a largo plazo, respetando al mismo tiempo el equilibrio ecológico del ecosistema del techo. El fertilizante promueve un crecimiento constante y duradero, fomentando una alfombra de sedum densa, completa y vibrante.</p>
<p>La composición equilibrada de NPK está especialmente formulada para el sedum y otras suculentas. Gracias a su contenido adicional de potasio, el fertilizante mejora la resistencia a la sequía, al calor y a las condiciones meteorológicas extremas. Evita la aparición de zonas desnudas y la formación de musgo mediante una liberación estable y controlada de nutrientes. Además, fortalece los sistemas radiculares, mejorando tanto la durabilidad como la estabilidad del sustrato del tejado.</p>
<p>Una capa vegetal sana favorece la biodiversidad al atraer abejas, mariposas y otros insectos beneficiosos. La fórmula respetuosa con el medio ambiente es completamente biodegradable y ofrece resultados duraderos gracias a la liberación gradual de los nutrientes. El producto es fácil de aplicar y adecuado tanto para cubiertas verdes extensivas como intensivas.</p>"
gid://shopify/Collection/657059053892,fertilizante-para-flores-es,Fertilizante para Flores,"<p>El Fertilizante para Flores Organifer está especialmente desarrollado para ofrecer un apoyo óptimo a las plantas con flor durante toda la temporada. Su composición equilibrada favorece un fuerte desarrollo radicular, permitiendo que las plantas absorban los nutrientes de forma más eficaz y formen nuevos brotes florales. Esto se traduce en floraciones más abundantes, densas y duraderas.</p>
<p>Además, el fertilizante para flores refuerza la resistencia natural, haciendo que las plantas sean menos sensibles al estrés, la sequía y la presión de hongos. Adecuado para variedades anuales y perennes, para bordes de jardín, macetas, balcones y jardines ornamentales. Es la elección ideal para quienes desean lograr una intensidad de color máxima y una floración abundante.</p>"
gid://shopify/Collection/657059119428,fertilizante-para-plantas-de-interior-es,Fertilizante para Plantas de Interior,"<p>El Fertilizante para Plantas de Interior Organifer está cuidadosamente formulado para satisfacer las necesidades de las plantas verdes y con flor que se cultivan en interiores. Estas plantas tienen un acceso limitado a nutrientes naturales, por lo que una fertilización dirigida es esencial. Este fertilizante favorece raíces fuertes, hojas brillantes y un crecimiento constante y saludable.</p>
<p>La fórmula suave evita la sobrefertilización y es perfectamente adecuada para variedades sensibles como Calathea, Alocasia, Monstera y Ficus. Además, los nutrientes mejoran la resistencia frente a problemas comunes en interiores, como el aire seco, la luz limitada y el estrés radicular. Ideal tanto para principiantes como para expertos que deseen ver prosperar su jungla interior.</p>"
gid://shopify/Collection/657059152196,fertilizante-para-suculentas-es,Fertilizante para Suculentas,"<p>El Fertilizante para Suculentas Organifer está especialmente diseñado para las necesidades nutricionales únicas de las suculentas, cactus y plantas desérticas. Estas especies crecen lentamente y requieren un fertilizante ligero y equilibrado que preserve la estructura de las hojas y evite la sobrefertilización.</p>
<p>El fertilizante estimula un crecimiento compacto, colores vivos y hojas firmes capaces de almacenar agua de manera eficiente. Además, favorece un desarrollo radicular saludable, esencial para plantas sensibles a la pudrición de raíces.</p>
<p>Perfecto para Aloe Vera, Echeveria, Haworthia, Sansevieria, cactus y otras especies tolerantes a la sequía, tanto en interior como en exterior.</p>"
gid://shopify/Collection/657059250500,fertilizante-para-hortalizas,Fertilizante para Hortalizas,"<p>El Fertilizante para Hortalizas Organifer está formulado para proporcionar a las plantas del huerto los nutrientes que necesitan para un crecimiento vigoroso y una cosecha abundante. Estimula el desarrollo de hojas sanas, raíces fuertes y frutos firmes. Gracias a la proporción equilibrada de nitrógeno, fósforo y potasio, las plantas hortícolas reciben apoyo en todas las etapas de crecimiento, desde el plantón hasta la cosecha.</p>
<p>Este fertilizante es ideal para tomates, pepinos, pimientos, calabacines, coles, hortalizas de hoja y cultivos de raíz. Además, el fertilizante para hortalizas mejora la estructura del suelo y la actividad microbiana, contribuyendo a bancales sostenibles y productivos.</p>"
gid://shopify/Collection/657059381572,fertilizante,Fertilizante,"<p>El Fertilizante para Césped Organifer está diseñado para crear y mantener un césped fuerte, verde y uniforme. Favorece un crecimiento radicular denso, lo que hace que el césped sea más resistente al tráfico peatonal, la sequía y las fluctuaciones de temperatura. El fertilizante promueve un color verde intenso, reduce las zonas despobladas y ayuda a controlar el crecimiento de musgo y malas hierbas.</p>
<p>Ideal para céspedes ornamentales, áreas de juego, campos deportivos y superficies de hierba sometidas a un uso intensivo. Gracias a su composición equilibrada, el césped permanece bien nutrido y lleno de vitalidad durante un largo periodo, incluso en condiciones de cultivo exigentes.</p>"
gid://shopify/Collection/657059414340,fertilizante-para-hierbas,Fertilizante para Hierbas,"<p>El Fertilizante para Hierbas Organifer proporciona a las hierbas aromáticas nutrientes suaves y naturales que mejoran su sabor, aroma y calidad foliar. Muchas hierbas crecen en suelos relativamente pobres y requieren un fertilizante equilibrado que estimule un crecimiento compacto y un aroma intenso sin forzar las plantas.</p>
<p>Este fertilizante es perfectamente adecuado para albahaca, menta, orégano, tomillo, salvia, perejil y otras hierbas mediterráneas o productoras de hojas. Los nutrientes favorecen un desarrollo radicular fuerte y una estructura vegetal sana, ayudando a que las hierbas se mantengan frescas y productivas durante más tiempo.</p>"
gid://shopify/Collection/657059479876,fertilizante-para-frutas-es,Fertilizante para frutas,"<p>El Fertilizante para Frutales Organifer proporciona los nutrientes esenciales que los árboles frutales, arbustos de bayas y plantas de frutos blandos necesitan para la formación de flores, el cuajado y el desarrollo del sabor. Este fertilizante favorece un sistema radicular fuerte, un crecimiento saludable del follaje y la producción de frutos jugosos y aromáticos.</p>
<p>Adecuado para fresas, frambuesas, moras, arándanos, uvas, manzanos, perales y variedades de cítricos. El fertilizante para frutales aumenta la resistencia natural frente a enfermedades y factores de estrés, ayudando a que las plantas se mantengan estables y más productivas durante toda la temporada.</p>"
gid://shopify/Collection/657059578180,fertilizante-para-arboles,Fertilizante para Árboles,"<p>El Fertilizante para Árboles Organifer está especialmente formulado para apoyar tanto a los árboles jóvenes como a los adultos en el logro de un crecimiento sano y equilibrado. Los nutrientes penetran profundamente en el suelo, estimulando una fuerte expansión radicular, esencial para la estabilidad, la absorción de agua y la vitalidad a largo plazo.</p>
<p>Además, favorece el desarrollo de ramas robustas, un follaje sano y una estructura arbórea resistente. Adecuado para árboles ornamentales, árboles de alineación, frutales y especies mediterráneas como los olivos.</p>
<p>El fertilizante para árboles ayuda a los árboles a recuperarse de la poda, el estrés, la sequía y las condiciones de suelo pobres, contribuyendo a una temporada de crecimiento saludable y resistente.</p>"
gid://shopify/Collection/657060331844,excremento-de-insecto-de-moscas-soldado-negras,Excremento de Insecto de Moscas Soldado Negras,"<p>Los Pellets de Fertilizante de Excremento de Insecto de Organifer están hechos de 100% excremento puro de larvas de Moscas Soldado Negras. Es un producto de alta calidad fabricado en los Países Bajos, secado y sanitizado mediante calentamiento, y luego comprimido en micro-pellets únicos.</p>
<p>El excremento de Organifer es altamente abundante en quitina. La quitina es un superalimento para los microorganismos que la descomponen. Durante este proceso, se liberan enzimas (quitinasas) que inducen a la planta a activar sus mecanismos de defensa naturales. Esto hace que la planta sea menos susceptible a enfermedades y plagas. No es de extrañar que el fertilizante de insectos de Organifer se utilice con éxito en la industria hortícola.</p>"
gid://shopify/Collection/657060528452,tabletas-de-fertilizante-todo-en-uno-organifer,Tabletas de Fertilizante Todo-en-Uno Organifer,"<p>Estas tabletas de fertilizante Todo-en-Uno con rhizobacterias han sido específicamente desarrolladas para nutrir óptimamente las plantas a lo largo del año. La tecnología de liberación lenta, que libera elementos macro y micro de manera controlada, estructura tu planta y asegura un equilibrio de nutrientes que previene la sobredosis o la dosis insuficiente. Así, la planta recibe exactamente lo que necesita para un crecimiento saludable y floración.</p>
<p>Con nuestras tabletas Organifer Todo-en-Uno, ya no tienes que preocuparte por el cuidado de tus plantas. Estas tabletas contienen elementos macro y micro esenciales para el crecimiento saludable de las plantas. Su liberación controlada asegura un suministro equilibrado de nutrientes necesarios para plantas más saludables y vigorosas.</p>
<p>Los rhizobacterias y el ácido fúlvico añadidos mejoran aún más estos resultados al fijar nitrógeno y movilizar elementos para la planta. También aumentan el contenido de clorofila y descomponen sustancias orgánicas, beneficiando la salud y la floración de tus plantas.</p>
<p>Cuando se utilizan correctamente, las tabletas de fertilizante Organifer Todo-en-Uno son una solución simple, económica y eficaz para fertilizar plantas nuevas y existentes. Estas tabletas de fertilizante son ideales para plantas en maceta, tina o colgantes y contienen todo lo que tus plantas necesitan para un crecimiento saludable y una floración durante todo el año.</p>"
gid://shopify/Collection/657535631684,acondicionadores-de-suelo,Acondicionadores de suelo,"<p>Debido al uso intensivo, la calidad de nuestros suelos está constantemente bajo presión. El uso prolongado de fertilizantes artificiales limitados a unos pocos elementos ha agotado el suelo. La fertilidad mineral disminuye, al igual que el contenido de humus, la estructura y la resistencia a enfermedades del suelo. Como resultado, las plantas tienen menos resistencia y nuestros alimentos se han empobrecido en minerales esenciales y oligoelementos.</p>
<p>El uso exclusivo de fertilizantes artificiales, cal y materia orgánica no permite la recuperación sostenible de los suelos. El uso de polvo de roca como fuente natural de minerales para aumentar la fertilidad del suelo es conocido desde hace mucho tiempo, pero ha sido descuidado debido al enfoque en los fertilizantes sintéticos modernos.</p>
<p>Desde 2009, Organifer se ha comprometido con la restauración sostenible de la calidad del suelo.</p>"
gid://shopify/Collection/657535664452,fertilizante-liquido-organifer,Fertilizante Líquido Organifer,"<p>El Fertilizante Líquido Organifer se utiliza con gran éxito en hidroponía y cultivo en sustrato, tanto en interiores como en exteriores, en la agricultura, en campos de golf y deportivos, en jardines ornamentales y de vegetales, así como para plantas de interior.</p>"
gid://shopify/Collection/657535697220,enfermedades-y-plagas,Enfermedades y Plagas,"<p>La respuesta ecológica y sostenible a una amplia gama de problemas en plantas y jardines. Nuestros concentrados están hechos exclusivamente de ingredientes derivados de plantas que son absorbidos por el suelo y las raíces de las plantas. Una vez allí, estimulan el crecimiento, la vitalidad y las capacidades regenerativas naturales de las plantas, abordando los desequilibrios y factores externos que afectan a las plantas.</p>
<p>Se reconoce desde hace tiempo que las plantas pueden ser protegidas y fortalecidas considerando el ciclo natural y las relaciones simbióticas. Organifer ha avanzado este principio y aprovecha extractos herbales específicos para crear una solución eficiente que puede aplicarse tanto de manera preventiva como curativa.</p>"
gid://shopify/Collection/657535729988,fertilizante-organico,Fertilizante Orgánico,"<p>El fertilizante orgánico es muy adecuado como fertilizante base para jardines ornamentales, bordes, céspedes, cultivos de bulbos y tubérculos, huertos, rosales, plantas en maceta y árboles frutales. Los gránulos mejoran la estructura del suelo y la capacidad de retención de agua, permiten una vida del suelo fértil y proporcionan un enriquecimiento natural del suelo para mantener un equilibrio continuo. Este fertilizante todo terreno es adecuado para todos los tipos de suelo y puede usarse perfectamente como fertilizante base para céspedes, bordes, huertos, pastos y huertas. Además, los gránulos pueden aplicarse como un activador del suelo a través de la estimulación rápida de una vida del suelo positiva.</p>"
gid://shopify/Collection/657535762756,tabletas,Tabletas,"<p>Estas tabletas de fertilizante Todo-en-Uno con Rhizobacterias han sido específicamente desarrolladas para nutrir de manera óptima las plantas durante todo el año. La tecnología de liberación lenta, que libera macro y microelementos en dosis, estructura tu planta y asegura un equilibrio de nutrientes que previene la sobredosis o la dosis insuficiente. Así, la planta recibe exactamente lo que necesita para un crecimiento saludable y floración.</p>
<p>Con nuestras tabletas Organifer Todo-en-Uno, ya no tienes que preocuparte por el cuidado de tus plantas. Estas tabletas contienen elementos macro y micro esenciales para el crecimiento saludable de las plantas. Su liberación dosificada asegura un suministro equilibrado de nutrientes necesarios para plantas más saludables y vitales.</p>
<p>Las Rhizobacterias y Fulvic añadidas mejoran aún más estos resultados al fijar nitrógeno y movilizar elementos para la planta. También aumentan el contenido de clorofila y descomponen sustancias orgánicas, beneficiando la salud y floración de tus plantas.</p>
<p>Cuando se utilizan correctamente, las tabletas de fertilizante Organifer Todo-en-Uno son una solución simple, económica y efectiva para fertilizar plantas nuevas y existentes. Estas tabletas de fertilizante son ideales para plantas en maceta, tina o colgantes y contienen todo lo que tus plantas necesitan para un crecimiento saludable y una floración durante todo el año.</p>"
