ID,Handle,Title,DescriptionHTML
gid://shopify/Collection/657054171460,pellets-de-estiercol-de-vaca,Pellets de Estiércol de Vaca,"<p>Los pellets de estiércol de vaca 3en1 son altamente adecuados como fertilizante de plantación para jardines ornamentales, bordes, céspedes, plantas de bulbos y tubérculos, huertos, rosas, plantas en maceta y árboles frutales. Estos pellets mejoran la estructura del suelo y la capacidad de retención de agua, promueven un ambiente de suelo fértil y proporcionan un enriquecimiento natural del suelo para mantener un equilibrio a largo plazo. Son un fertilizante todoterreno adecuado para todos los tipos de suelo y pueden usarse perfectamente como fertilizante de plantación y base para céspedes, bordes, huertos, pastos y huertas. Además, los pellets pueden utilizarse como un activador del suelo al estimular rápidamente una actividad del suelo positiva.</p>"
gid://shopify/Collection/657054204228,fertilizante-de-otono,Fertilizante de Otoño,"<p>Este fertilizante profesional de otoño es muy rico en potasio y proporciona protección extra contra el frío invierno para céspedes, hierba y plantas. El fertilizante aumenta la resistencia a los efectos directos de las heladas. Además, se han añadido minerales y elementos traza a los gránulos del fertilizante. Los gránulos del Fertilizante de Otoño Todo en Uno aseguran que su césped y plantas sean de un verde oscuro, fuertes y resistentes al invierno. Esta nutrición de alta calidad tiene un efecto indirecto sobre el musgo y las malezas. Los gránulos de fertilizante inodoros están enriquecidos con nitrógeno y potasio fácilmente absorbibles (NPK 6-2-12). Gracias al efecto duradero (+100 días), todavía habrá suficientes nutrientes para un buen rebrote del césped y la formación de un césped denso y fuerte en el que el musgo y las malezas no tienen oportunidad, incluso después de escarificar. Esto resulta en un césped saludable y fuerte que puede resistir mejor el desgaste, la sequía y las heladas. La efectividad del fertilizante de otoño a menudo se subestima. Asegurando que el césped entre al invierno fuerte y endurecido, se previenen problemas en la primavera.</p>"
gid://shopify/Collection/657054236996,fertilizante-para-pastos-todo-en-uno,Fertilizante para Pastos Todo-en-Uno,"<p>El Fertilizante para Pastos Todo-en-Uno es la mejor opción para una fertilización óptima de un pasto para caballos. También es muy adecuado para pastos de siega y tierras de pastoreo para ganado de aficionados. Un fertilizante para pastos todo-en-uno completo basado en estiércol higienizado, enriquecido con minerales naturales y elementos traza para un crecimiento uniforme y un césped fuerte. El resultado es hierba/forraje de alta calidad y sabroso y un suelo naturalmente fértil.</p>"
gid://shopify/Collection/657054302532,fertilizante-vegetal-vegano,Fertilizante Vegetal Vegano,"<p>El Fertilizante Vegetal Vegano es un fertilizante orgánico 100% basado en plantas, completamente libre de materiales crudos animales como el estiércol. Este fertilizante profesional es adecuado para todo tipo de suelos y es excelente como fertilizante de plantación y básico para céspedes, parterres de flores, huertos, huertas y plantas de interior. El Fertilizante Vegetal Vegano es un muy buen activador del suelo y estimula la vida del suelo. Debido a su alto contenido de materia orgánica, el fertilizante mejora la estructura del suelo y la retención de humedad. Además, el fertilizante vegetal vegano permite una vida del suelo fértil y asegura un enriquecimiento natural del suelo para mantener el suelo permanentemente equilibrado. El Fertilizante Vegetal Vegano tiene una relación NPK favorable (6-3-2) y una composición particularmente rica. Los nutrientes son absorbidos de manera excelente por las plantas y liberados de manera dosificada. Este fertilizante vegetal es universalmente aplicable, tiene un olor agradable y es seguro para humanos y animales.</p>"
gid://shopify/Collection/657054335300,fertilizante-para-cesped-todo-en-uno,Fertilizante para Césped Todo-en-Uno,"<p>El Fertilizante para Césped Todo-en-Uno está desarrollado para crear y mantener un césped verde profundo sin musgo ni malezas.</p>
<p>Es un fertilizante orgánico-mineral de alta calidad adecuado para fertilizar cualquier tipo de césped y suelo. Debido a la presencia de magnesio extra, cada césped se torna intensamente verde. Apto para nuevas instalaciones y fertilizaciones de mantenimiento. La combinación única de componentes de acción rápida y liberación lenta permite un inicio rápido del crecimiento junto con 100 días de nutrición completa. El Fertilizante para Césped Todo-en-Uno estimula positivamente la vida del suelo e incrementa la fertilidad natural del suelo con cada aplicación. El resultado es un césped denso y saludable sin espacio para el musgo ni las malezas.</p>
<p>El Fertilizante para Césped Todo-en-Uno tiene un alto contenido de potasio para un césped fuerte que es más resistente al desgaste, la sequía y las heladas. El fertilizante es excelente para aplicar tanto en primavera como en otoño, permitiendo la fertilización del césped durante todo el año con el mismo producto. La mezcla de microgranulados de alta calidad asegura un crecimiento gradual, estimula un césped fuerte y saludable, y mejora el suelo. El granulado de liberación lenta tiene una acción de inicio rápido mientras mantiene efectos duraderos.</p>
<p>La mezcla única de nutrientes es liberada gradualmente por la vida del suelo. La formación de humus, minerales y elementos traza promueve un mejor desarrollo de las raíces y previene la lixiviación. Este fertilizante profesional es ideal para céspedes, campos deportivos y campos de golf donde se desea un césped fuerte y denso.</p>"
gid://shopify/Collection/657054368068,fertilizante-para-jardin-todo-en-uno,Fertilizante para Jardín Todo-en-Uno,"<p>El Fertilizante para Jardín Todo-en-Uno está desarrollado para un rendimiento óptimo de plantas con flores, arbustos, árboles, rosas, plantas perennes, bulbos, árboles frutales, fresas, frutas y hortalizas de raíz. Disfruta de frutas más sabrosas y abundantes, plantas hermosas, colores más profundos y más flores. Mejora la estructura del suelo y activa una vida positiva en el suelo. El alto contenido de potasio asegura una planta fuerte y resiliente. Además, este fertilizante es extra rico en magnesio para una fotosíntesis óptima y colores más intensos. El Fertilizante para Jardín Todo-en-Uno no afecta la acidez del suelo, lo que lo hace seguro de usar y adecuado para plantas que prefieren suelos ácidos. Este fertilizante profesional es universalmente aplicable en cualquier huerto y jardín ornamental.</p>"
gid://shopify/Collection/657054499140,fertilizante-granular-de-cal,Fertilizante granular de cal,"<p>Este fertilizante único de cal para todas las estaciones de Organifer ha sido enriquecido con magnesio. Es ideal para proteger su suelo de volverse demasiado ácido. También funciona indirectamente contra el musgo. La aplicación de cal es vital para corregir el nivel de acidez (valor de pH) en su césped o huerto. Para cada planta, es muy importante que el suelo tenga el valor de pH correcto. A través de la absorción de nutrientes, que generalmente también se suministran al jardín y al césped, el suelo se vuelve ácido. Excepto para las plantas ""amantes de la acidez"", esto está lejos de ser ideal para un buen y saludable crecimiento de las plantas cultivadas y los pastos. El magnesio añadido asegura un color verde profundo y contribuye a la fotosíntesis óptima y la fertilidad del suelo.</p>"
gid://shopify/Collection/657054728516,harina-de-roca-volcanica,Harina de roca volcánica,"<p>Organifer Primordial Rock Lavameal es la harina de roca primordial de la más alta calidad disponible en el mercado. Es una harina de lava única con la mayor concentración de minerales absorbibles y las mejores capacidades de procesamiento. Sumamente versátil, es perfecta para esparcir, dispersar o mezclar. Se utiliza extensamente en jardines como mejorador de suelos y es excelente para proteger plantas, como el boj, de plagas. Además, esta rica harina de lava combate indirectamente al equiseto y otras malezas.</p>"
gid://shopify/Collection/657054826820,plantas-en-macetas-e-hidroponia,Plantas en macetas e hidroponía,"<p>Los hidrogránulos de Organifer son ideales tanto para hidroponía como para una capa de drenaje en macetas y contenedores de plantas. <br>Los hidrogránulos garantizan un crecimiento óptimo de las plantas y proporcionan soporte a las raíces. Por ello, al llenar una maceta, siempre agregue primero una capa de hidrogránulos en el fondo. Dependiendo del tamaño de la maceta, se recomienda utilizar una capa de 3 a 6 cm en la base.  <br>Esta capa mejora la gestión del agua en la maceta y favorece un mejor desarrollo de la planta. Para macetas de exterior, es fundamental que haya un orificio en la base, permitiendo que el exceso de agua se drene correctamente.</p>"
gid://shopify/Collection/657054892356,fertilizante-liquido-para-la-fase-de-crecimiento-amino-power,Fertilizante Líquido para la Fase de Crecimiento - Amino Power,"<p>El Fertilizante Líquido para la Fase de Crecimiento - Amino Power es un fertilizante completo específicamente para la fase de crecimiento de toda planta y cultivo (Fase 1). Este poderoso concentrado contiene una mezcla única de aminoácidos esenciales y contiene 9% de nitrógeno orgánico proveniente de proteínas hidrolizadas enzimáticamente. Organifer Amino Power también incluye una mezcla única con 18 aminoácidos proteinogénicos.</p>
<p>El Fertilizante Líquido para la Fase de Crecimiento - Amino Power reduce el estrés abiótico y asegura un rendimiento óptimo, salud y crecimiento eficiente en energía.</p>
<p>El producto está basado en algas marinas, lo que lo hace de rápida y fácil absorción, promoviendo un crecimiento saludable y uniforme y un mejor desarrollo de las raíces. Proporciona el primer impulso para una planta saludable y vigorosa y una floración completa.</p>
<p>El Fertilizante Líquido para la Fase de Crecimiento - Amino Power se utiliza con gran éxito en hidroponía y cultivo en sustrato, cultivo interior y exterior, agricultura, así como en jardines ornamentales y de utilidad. Además, el producto también es adecuado para plantas de interior. El Fertilizante Líquido para la Fase de Crecimiento - Amino Power también puede ser utilizado en horticultura orgánica y es universalmente aplicable a todas las plantas y cultivos. Es ideal para el cultivo orgánico en suelo o coco. Además, el producto corrige problemas de nitrógeno en las plantas. Una deficiencia de nitrógeno puede reconocerse por hojas amarillas.</p>"
gid://shopify/Collection/657054925124,estimulador-de-raices-concentrado-roots-power,Estimulador de Raíces - Concentrado Roots-Power,"<p>El Estimulador de Raíces - Concentrado Roots-Power es un estimulador orgánico de raíces altamente concentrado. Este estimulador asegura un desarrollo rápido y vigoroso de las raíces y una rápida recuperación después del trasplante en cada planta. Además, el estimulador mejora la absorción de nutrientes y la estructura del suelo. Es ideal para la fase de crecimiento y las primeras semanas de la fase de floración. Asegura que la planta ya tenga suficientes raíces al comienzo de la fase de floración, por lo que puede dedicar toda su energía a florecer. Por lo tanto, se debe dejar de aplicar el Estimulador de Raíces - Concentrado Roots-Power después de la tercera semana de floración. Estimula el crecimiento de las raíces y aumenta la resistencia de la planta. Actúa de manera rápida y eficiente, y es absorbido casi inmediatamente por la planta.</p>
<p>El Estimulador de Raíces - Concentrado Roots-Power promueve el desarrollo de plantas fuertes. El producto es ideal para esquejes y para plantas que están siendo trasladadas. Tan pronto como las primeras raíces de la planta sean visibles, se puede aplicar el Estimulador de Raíces - Concentrado Roots-Power. El producto conduce a un desarrollo de raíces mejor y más rápido. También puede ser utilizado en plantas infestadas por insectos que comen raíces para regenerar rápidamente las raíces.</p>
<p>El efecto de este poderoso concentrado orgánico es asombroso. Este líquido revitalizante asegura un desarrollo de raíces más rápido y mejor, aumenta la absorción de oxígeno y acelera el transporte de iones desde el inicio.</p>"
gid://shopify/Collection/657054957892,fertilizante-liquido-para-la-fase-de-floracion-iron-power,Fertilizante Líquido para la Fase de Floración - Iron Power,"<p>Nutrición completa altamente concentrada basada en el Fertilizante Líquido para la Fase de Floración - Iron Power, para la fase de floración de la planta. El Fertilizante Líquido para la Fase de Floración - Iron Power contiene todos los elementos importantes para el desarrollo óptimo de brotes, flores, frutos y plantas. Suministro inmediato de energía complementando el Adenosín Difosfato (ADP) con Adenosín Trifosfato (ATP). Estimula la fase de floración con Fósforo (P) y Potasio (K). Gracias a la forma quelada única de Fe, esta forma de hierro no requiere energía de la planta. Esta energía beneficia completamente la floración. Además, el Fertilizante Líquido para la Fase de Floración - Iron Power mantiene las hojas saludables y verdes.</p>
<p>El Fertilizante Líquido para la Fase de Floración - Iron Power es un fertilizante foliar y radicular concentrado, que se administra al final de la fase de crecimiento y en las primeras 3 semanas de la fase de floración de la planta. El Fertilizante Líquido para la Fase de Floración - Iron Power contiene hormonas naturales para la floración y el crecimiento e incrementa el contenido de citoquinina y clorofila de las hojas. Esto también aumenta el nivel de azúcar y estimula la producción de clorofila. Este fertilizante aumenta la resistencia de la planta. La planta forma más brotes y flores, lo que lleva a una planta vigorosa con abundante floración y alto rendimiento.</p>
<p>El Fertilizante Líquido para la Fase de Floración - Iron Power se utiliza con gran éxito en hidroponía y cultivo en sustrato, tanto en interiores como en exteriores, en agricultura, en campos de golf y deportivos, en jardines ornamentales y de hortalizas, así como para plantas de interior. El Fertilizante Líquido para la Fase de Floración - Iron Power aumenta los rendimientos y asegura una mayor calidad, más sabor, colores más intensos y frutos más fuertes en todos los cultivos.</p>"
gid://shopify/Collection/657054990660,concentrado-vital-para-buxus,Concentrado Vital para Buxus,"<p>El Concentrado Vital para Buxus ayuda a tu boj a ser más resistente y vibrante de manera 100% natural. Esto resulta en un boj más fuerte y saludable que crece de manera equilibrada y armoniosa. Además, un boj robusto y vibrante está mejor equipado para defenderse de ataques de insectos como la polilla del boj y enfermedades como el hongo del boj. El Concentrado Vital para Buxus es un producto excepcionalmente efectivo, estimulante y nutritivo para todo boj.</p>
<p>Consiste en una mezcla de extractos herbales naturales específicos y es seguro para personas, animales y el medio ambiente. Los ingredientes del Concentrado Vital para Buxus de 1000 ml se absorben lentamente por la planta y las raíces, y luego se distribuyen a través del flujo de savia. Esto imparte resiliencia y vitalidad a todo el boj.</p>
<p>El Concentrado Vital para Buxus puede usarse tanto en suelo completo como en macetas, regando la planta y el suelo. La solución es absorbida por el suelo y las raíces de la planta. Se recomienda tratar durante la temporada de crecimiento y repetir cada 3 semanas. Vierte la solución de Concentrado Vital para Buxus sobre toda la planta hasta que esté goteando. Si hay signos de infestación o lluvia excesiva, aumenta el intervalo de aplicación.</p>"
gid://shopify/Collection/657055023428,concentrado-preventivo-contra-caracoles,Concentrado Preventivo contra Caracoles,"<p>El Concentrado Preventivo contra Caracoles es adecuado para molestias excesivas causadas por caracoles, orugas, forrajeo de fauna silvestre y picoteo de aves. Ideal para la agricultura, jardines ornamentales y vegetales, macetas, así como céspedes, superficies de césped, campos deportivos y campos de golf. El Concentrado Preventivo contra Caracoles consta de una composición altamente concentrada de extractos herbales específicos.</p>
<p>La solución es de origen natural y botánico. El producto no es tóxico, no persistente y no deja residuos en el medio ambiente. El Concentrado Preventivo contra Caracoles ofrece un efecto disuasorio indirecto sobre caracoles, orugas, fauna silvestre y aves. El producto apoya la capacidad natural de recuperación de la planta, actuando de manera nutritiva, fortalecedora y revitalizante.</p>
<p>El Concentrado Preventivo contra Caracoles ha sido especialmente desarrollado para prevenir daños causados por caracoles, orugas, fauna silvestre y aves, pero no los mata. Este producto es 100% natural y no contiene sustancias nocivas. ¡También es seguro para niños, mascotas y habitantes beneficiosos del jardín! El Concentrado Preventivo contra Caracoles está hecho de extractos herbales naturales. Estos extractos son absorbidos por el suelo y la planta. Los extractos herbales hacen que la planta y su entorno sean más resistentes al forrajeo. Las plagas ya no se alimentarán de las plantas tratadas debido al entorno poco atractivo. Las plagas se retirarán a sus escondites y no podrán desarrollarse más. De esta manera, la molestia disminuirá naturalmente.</p>
<p>El Concentrado Preventivo contra Caracoles es adecuado para jardines orgánicos. Seguro para personas, animales y el medio ambiente. ¡También seguro para depredadores naturales, mascotas e insectos beneficiosos!</p>"
gid://shopify/Collection/657055121732,concentrado-de-phytophthora,Concentrado de Phytophthora,"<p>El Concentrado de Phytophthora está hecho de concentrados herbales específicamente activos y es seguro para humanos, animales y el medio ambiente. El producto apoya la capacidad de recuperación natural. Además, nutre, alimenta y fortalece a las plantas contra influencias externas, en el suelo y en las raíces. Tiene un efecto indirecto contra la Phytophthora en papas y tomates. La solución es absorbida por las hojas de la planta y refuerza su sistema de defensa. El desarrollo de la Phytophthora se ve limitado y prevenido.</p>"
gid://shopify/Collection/657055154500,concentrado-para-nematodos,Concentrado para Nematodos,"<p>Protege naturalmente a las plantas de varios nematodos dañinos en el suelo, como los nematodos agalladores (que causan agotamiento en las rosas), diversos nematodos radiculares negativos, nematodos quistosos de la papa y nematodos quistosos de la remolacha.</p>
<p>El producto es una composición concentrada de concentrados herbales de acción específica y no es tóxico para las personas, los animales y el medio ambiente. El producto no es persistente; se descompone en el suelo y no deja residuos.</p>
<p>Nematodos – El Concentrado de Nematodos del Suelo proporciona una acción preventiva contra plagas en el suelo. La sustancia es absorbida por las raíces de las plantas, permitiéndoles desarrollar su propio sistema de defensa. Los nematodos parásitos ya no se alimentarán de las raíces. Como resultado, la población disminuye y, con el tiempo, la molestia desaparecerá por completo.</p>"
gid://shopify/Collection/657055220036,concentrado-de-hongos-del-suelo,Concentrado de Hongos del Suelo,"<p>El Concentrado de Hongos del Suelo es una mezcla altamente concentrada de concentrados herbales de acción específica y ofrece acción preventiva contra hongos del suelo como verticillium (enfermedad del marchitamiento), pythium (enfermedad de los plantones) y fusarium (pudrición del pie y de la raíz). El producto apoya la capacidad natural de recuperación, proporciona cuidado, nutrición y fortalece las plantas contra influencias externas, en el suelo y en las raíces. El Concentrado de Hongos del Suelo es de origen natural y vegetal y no es tóxico para humanos, animales y el medio ambiente.</p>
<p>Aprobado para jardinería orgánica y ecológica. El Concentrado de Hongos del Suelo es absorbido por el follaje del cultivo y el suelo. Gracias a los ingredientes presentes que estimulan las raíces y cuidan los cultivos, las raíces, las hojas y el suelo desarrollarán una mayor resistencia y su propio sistema de defensa. Los ingredientes del producto, además de mejorar el suelo y fortalecer las plantas, tienen un efecto indirecto sobre los hongos nocivos del suelo.</p>"
gid://shopify/Collection/657055252804,concentrado-para-insectos-de-cesped,Concentrado para Insectos de Césped,"<p>El Concentrado para Insectos de Césped tiene un efecto repelente indirecto sobre la presencia de larvas de escarabajos (como el escarabajo de mayo, escarabajo de junio, cetonia dorada, escarabajo de Salland, etc.), típulas (larvas de mosca de la grúa) y larvas de mosca de los hongos en el césped. El Concentrado para Insectos de Césped es absorbido tanto por la raíz como por la hoja de la planta de césped. Aumenta la resiliencia del césped, permitiéndole desarrollar su propio mecanismo de defensa. El suelo también se beneficia positivamente. Las raíces de las plantas se estimulan, promoviendo un crecimiento saludable del césped. Las larvas de escarabajos, típulas y otras larvas dañinas evitarán las plantas. Estas plagas ya no encontrarán atractivas las raíces y hojas. Con el uso preventivo, las larvas de típulas, escarabajos y moscas de los hongos no alcanzarán la etapa de pupa.</p>
<p>El césped se vuelve más saludable, las raíces crecen de nuevo y también se vuelven menos atractivas para las plagas. El Concentrado para Insectos de Césped está específicamente diseñado para larvas de escarabajos, típulas y larvas de moscas de los hongos en céspedes, pastizales y campos deportivos. El producto consiste en extractos herbales específicamente activos y tiene un papel preventivo indirecto en repeler insectos del suelo. Apoya la capacidad de recuperación natural, proporciona cuidado, nutre y fortalece las plantas contra factores externos, en el suelo y en las raíces. El Concentrado para Insectos de Césped es de origen natural y vegetal, no es tóxico para humanos, animales ni el medio ambiente, y es adecuado para la jardinería orgánica.</p>"
gid://shopify/Collection/657055318340,concentrado-de-insectos-del-suelo,Concentrado de Insectos del Suelo,
gid://shopify/Collection/657055678788,concentrado-de-insectos-de-las-hojas,Concentrado de Insectos de las Hojas,"<p>El Concentrado de Insectos de las Hojas actúa de manera indirecta y preventiva contra atacantes naturales como los áfidos, cochinillas, áfidos de la raíz, cochinillas harinosas, cochinillas algodonosas, moscas blancas, orugas (incluidas las orugas de la polilla del boj), gorgojos del vino, escarabajos del lirio, cecidómidos, ácaros araña, moscas negras, polillas del puerro, pulgones negros de haba, picudos de la flor de fresa y saltahojas.</p>
<p>El agente es absorbido por las hojas de plantas, arbustos o árboles. A medida que aumenta la resistencia, la planta desarrollará, por así decirlo, su propio sistema de defensa a través de esta absorción. Los insectos que chupan y mastican las hojas desaparecen porque no les gusta el alimento. Otros insectos no se verán afectados. De esta manera, los problemas y daños desaparecerán naturalmente.</p>
<p>El Concentrado de Insectos de las Hojas consiste en una composición altamente concentrada de extractos herbales de acción específica. El producto es de origen vegetal natural y no tóxico para humanos, animales y el medio ambiente. El Concentrado de Insectos de las Hojas puede aplicarse por pulverización en el jardín ornamental, el huerto, y en la terraza o balcón. Las plantas comestibles pueden consumirse de manera segura.</p>"
gid://shopify/Collection/657055711556,concentrado-de-enfermedades-de-las-hojas,Concentrado de Enfermedades de las Hojas,"<p>El Concentrado de Enfermedades de las Hojas consta de una composición de extractos herbales de acción específica (no tóxicos) que hacen que las plantas sean resistentes contra los hongos de las hojas y las manchas foliares. Esto incluye el mildiú polvoroso y velloso, la roya, la enfermedad de las manchas foliares y la negrilla, así como los hongos de la hierba y de las hojas. Es adecuado para cultivos en jardines ornamentales, huertos y parques donde, debido a un suelo menos vital y una menor resistencia de las plantas, puede haber enfermedades foliares.</p>
<p>El producto apoya la capacidad natural de curación, proporcionando cuidado, nutrición y fortalecimiento a las plantas frente a influencias externas, en el suelo y en las raíces. El Concentrado de Enfermedades de las Hojas es absorbido por las hojas y raíces de los cultivos. Gracias a los ingredientes presentes que estimulan las raíces y cuidan las plantas, las plantas desarrollarán una mayor resistencia y vitalidad. El Concentrado de Enfermedades de las Hojas es mejor administrarlo de manera preventiva, especialmente cuando ha habido molestias y daños significativos en el pasado.</p>"
