ID,Handle,Title,DescriptionHTML
gid://shopify/Collection/657055744324,mejorador-de-suelo-de-harina-de-basalto,Mejorador de suelo de harina de basalto,"<p>El Mejorador de Suelo de Harina de Basalto para Suelo Arcilloso es excepcionalmente adecuado para mejorar los suelos arcillosos. Se caracteriza por valores electromagnéticos extraordinariamente altos. Reacciona con el complejo arcilla-humus, provocando que la arcilla se desmenuce. Rompe la interconexión entre las partículas de arcilla, resultando en un suelo más fácil de trabajar y más friable. Además, la harina de basalto tiene la característica positiva de fijar el nitrógeno, evitando que se lave rápidamente. En resumen, el suelo se vuelve más fácil de trabajar y adquiere una mejor estructura. También contiene altas concentraciones de silicio, cal, magnesio y oligoelementos que enriquecen el suelo. Un producto 100% natural hecho de basalto finamente molido, originario de roca volcánica de la Eifel.</p>"
gid://shopify/Collection/657055777092,semilla-para-cesped-ornamental,Semilla para Césped Ornamental,"<p>La Semilla para Césped Ornamental – Elegante ha sido desarrollada para aquellos que demandan un alto valor estético de su césped. Las festucas finas utilizadas aseguran un césped denso y de hojas finas. Esta mezcla profesional de semillas de césped prospera en condiciones secas y permanece robusta cuando se corta corto. El césped muestra un rico tono verde con una apariencia de alta calidad. Las festucas finas aseguran una pradera densa y de hojas finas.</p>
<p>Especialmente adecuada para céspedes ornamentales y jardines decorativos. Esta mezcla es a menudo referida como un césped ornamental o de sombra en la práctica. Compuesta principalmente por tipos de césped de crecimiento lento y variedades que retienen su color verde profundo todo el año, este césped es de bajo mantenimiento. La Semilla para Césped Ornamental – Elegante se adapta bien en regiones sombreadas, formando una cubierta de césped cerrada y puede ser cortada corto.</p>"
gid://shopify/Collection/657055809860,grava-volcanica,Grava volcánica,"<p>Organifer primeval rock lava grit es la grava volcánica de la más alta calidad disponible en el mercado. Este enmienda de suelo presume de la mayor concentración de minerales y las mejores capacidades de procesamiento. Es versátil y excelente para esparcir o mezclar. Ampliamente utilizada en jardines como mejorador de suelos, esta grava volcánica rica en minerales también muestra efectos indirectos contra el equiseto y otras malezas. Posee un volumen poroso muy alto y mejora las condiciones del suelo en suelos compactados. Mejora la estructura del suelo, la retención de agua y aire, la penetración de raíces y la disponibilidad de minerales en el suelo. Lavagruis se aplica amplia y exitosamente en jardines, agricultura, campos deportivos, silvicultura y viveros.</p>"
gid://shopify/Collection/657055973700,semilla-para-reparacion-de-cesped,Semilla para Reparación de Césped,"<p>La Semilla para Reparación de Césped – Resiliente contiene la fórmula ideal para la renovación y resiembra de todo tipo de céspedes. Su germinación súper rápida y establecimiento en césped existente, respaldada por su inmensa fuerza competitiva, garantizan un enfoque de Reparación Rápida. Llena rápidamente las áreas calvas y abiertas. El resultado es una renovación completa a un costo manejable, haciendo que cada césped luzca como nuevo.</p>
<p>La Semilla para Reparación de Césped – Resiliente combina la tolerancia a alto tráfico peatonal y el establecimiento rápido con una capacidad superior de regeneración. Esta mezcla de semillas de césped germina, se establece y se recupera rápidamente. La Semilla para Reparación de Césped – Resiliente asegura un césped denso donde el musgo y las malas hierbas no tienen oportunidad. Es una mezcla de semillas de césped de grado profesional, muy adecuada para la resiembra de céspedes después de escarificar. Su rápida germinación significa que cubre rápidamente las áreas calvas. Numerosos jardineros y administradores de campos deportivos eligen consistentemente la fórmula de la Semilla para Reparación de Césped – Resiliente por su emergencia y establecimiento excepcionalmente rápidos, alta capacidad de regeneración y apariencia atractiva. Una parte significativa de ryegrass fino inglés facilita la colocación suave, y su combinación con festuca de prado asegura un césped excepcionalmente robusto.</p>"
gid://shopify/Collection/657056039236,pellets-de-estiercol-de-pollo-de-organifer,Pellets de Estiércol de Pollo de Organifer,"<p>Los Pellets de Estiércol de Pollo de Organifer ofrecen la solución perfecta para cualquier jardinero que busque un suelo saludable y fértil. Estos pellets están hechos de estiércol de pollo 100% puro, obtenido de granjas holandesas. Son sostenibles y económicos, lo que los convierte en una opción atractiva para cualquier jardinero.</p>
<p>Nuestros pellets de estiércol de pollo se secan e higienizan mediante un compostaje eficiente, preservando los nutrientes. Esto asegura que nuestros pellets estén garantizados para estar libres de virus, gérmenes, hongos no deseados, malezas y bacterias, y proporcionen una calidad constante y los valores de fertilización más altos sin ninguna pérdida de calidad.</p>
<p>Los Pellets de Estiércol de Pollo de Organifer no solo son ricos en nutrientes sino también en materia orgánica. El alto contenido de materia orgánica asegura un suelo aireado que permite que los cultivos enraícen más profundamente y sean más resistentes a enfermedades y plagas. Mejora la estructura y fertilidad del suelo, contribuyendo a la salud del suelo. Estos pellets de estiércol de pollo tienen una gran capacidad de absorción de agua, hasta 4 veces su propio peso en humedad. Esto mantiene el suelo húmedo y retiene bien el agua, reduciendo la necesidad de riego y haciendo que el suelo sea menos vulnerable durante los períodos secos.</p>
<p>Los Pellets de Estiércol de Pollo de Organifer son adecuados para todo tipo de suelos y esenciales para un suelo saludable y funcional. Son perfectos para jardines ornamentales y de vegetales, céspedes, árboles y plantas. Los pellets son fáciles de esparcir por el terreno y el jardín, y no crean polvo. Elija los Pellets de Estiércol de Pollo de Organifer si busca una solución sostenible y económica para una fertilización 100% orgánica, que resulte en un suelo y cultivos saludables y fértiles.</p>"
gid://shopify/Collection/657056072004,semilla-de-pradera-para-pastos,Semilla de Pradera para Pastos,"<p>Semilla de Pradera para Pastos - Específicamente para Caballos y Ganado Pequeño es una mezcla de pasto de alta calidad adecuada tanto para siega como para pastoreo. La mezcla comprende semillas de césped certificadas seleccionadas; contiene ray-grass perenne, pasto de Timothy, festuca de los prados y poa de los prados. Debido a esta composición, esta mezcla es adecuada para la siembra en todo tipo de suelos y bajo condiciones extensivas.</p>
<p>Esta semilla de césped sigue siendo productiva y apetecible en todo tipo de suelo y es excelente para el pastoreo. Incluso bajo condiciones de crecimiento menos que ideales, la Semilla de Pradera para Pastos - Específicamente para Caballos y Ganado Pequeño se mantiene bien. La mezcla de pasto tiene un alto rendimiento y una larga vida útil. Semilla de Pradera para Pastos - Específicamente para Caballos y Ganado Pequeño es una mezcla de pasto de alta calidad para caballos y está compuesta por varios pastos con un punto de crecimiento bajo y una estructura amplia. Para un pasto increíblemente resistente al pisoteo. Produce césped muy sabroso, una mezcla de pastos saludables con bajo contenido de azúcar. La composición de esta mezcla de semillas de pasto también es adecuada para ovejas, cabras y ganado de afición.</p>"
gid://shopify/Collection/657056170308,estiercol-de-vaca-seco,Estiércol de Vaca Seco,"<p>El Estiércol de Vaca Seco Premium de Organifer se produce a partir de estiércol de vaca 100% puro y fresco. El estiércol de vaca higienizado, con aproximadamente un 55% de materia seca, es rico en nutrientes esenciales para un resultado perfecto. La alta proporción de materia orgánica, en la combinación adecuada con minerales, ácidos húmicos y elementos traza, hace que el estiércol de vaca sea el fertilizante y mejorador de suelo todo en uno perfecto.</p>
<p>Este producto de calidad holandesa se seca y se higieniza mediante compostaje en granjas holandesas, evitando transportes innecesarios y asegurando la producción a partir de estiércol fresco sin pérdidas. El método único de compostaje garantiza una calidad constante con los valores de fertilización más altos y un producto final perfecto, garantizado para estar completamente libre de virus, gérmenes, hongos no deseados, malezas y bacterias. Es altamente adecuado para céspedes, jardines ornamentales, bordes, plantas de bulbos y tubérculos, huertos, rosas, plantas en maceta, árboles frutales y pastos. Este estiércol seco consiste en estiércol de vaca 100% puro y fresco secado mediante compostaje. Mejora la estructura del suelo y la capacidad de retención de agua debido al alto contenido de materia orgánica, promueve un ambiente de suelo fértil y proporciona un enriquecimiento natural del suelo para mantener un equilibrio a largo plazo.</p>"
gid://shopify/Collection/657056268612,cal-de-algas-lithothamnium-calcareum,Cal de algas - Lithothamnium calcareum,"<p>La Cal de Algas Organifer se deriva de Lithothamnium calcareum (algas rojas) 100% puro, un producto natural sostenible obtenido del Océano Atlántico. A diferencia de otras marcas, la Cal de Algas Organifer permanece sin diluir, garantizando su pureza. Aunque puede no ser la opción de cal de algas más económica, presume de la más alta calidad y es completamente pura. Como consecuencia, demuestra una efectividad notable. La Cal de Algas Organifer ofrece un perfil nutricional único y óptimo, resultando en plantas saludables y un suelo fértil.</p>"
gid://shopify/Collection/657056334148,pellets-de-fertilizante-de-excremento-de-gusano-de-harina,Pellets de Fertilizante de Excremento de Gusano de Harina,"<p>Los pellets de estiércol Organifer hechos de excremento de gusano de harina están fabricados con 100% excremento puro (heces de insecto) de escarabajos de gusano de harina. Es un producto de alta calidad producido en los Países Bajos, secado y sanitizado mediante calentamiento, y luego comprimido en micro pellets únicos. Los Pellets de Estiércol de Gusano de Harina de Organifer son casi inodoros, lo que los hace adecuados también para plantas de interior.</p>
<p>Los pellets de fertilizante de excremento de gusano de harina de Organifer tienen un valor NPK de 4-2-2 y un alto contenido de quitina. Además, el producto es rico en minerales, oligoelementos y materia orgánica. Este fertilizante versátil contiene todos los nutrientes necesarios tanto para céspedes como para plantas. Dado que el excremento de Organifer es 100% orgánico, los nutrientes se liberan de manera controlada y no se lixivian. Al usar estiércol de insecto Organifer, se mejora el crecimiento de las plantas y del suelo, la floración y la resistencia.</p>"
gid://shopify/Collection/657056563524,mejorador-de-suelo-de-bentonita,Mejorador de suelo de bentonita,"<p>La Bentonita Organifer es el mejorador de suelo perfecto para suelos arenosos ligeros. Estos minerales de arcilla expandida de roca natural son especialmente adecuados para mejorar la estructura y cohesión del suelo arenoso. Como resultado, el suelo arenoso se vuelve más fácil de trabajar y la estructura del suelo mejorará significativamente tras su aplicación.</p>
<p>¡Pero eso no es todo! La Bentonita Organifer también mejora la gestión del agua del suelo y previene el lavado de fertilizantes. Esto se debe a su gran capacidad de absorción, siendo capaz de absorber hasta 10 veces su propio peso en agua. Por lo tanto, el suelo se secará menos rápidamente y la humedad permanecerá disponible para las plantas durante más tiempo, incluso durante los veranos secos.</p>
<p>La Bentonita Organifer también tiene un efecto positivo en la capacidad de almacenamiento de nutrientes y previene su lixiviación. Activa la vida del suelo y mejora el intercambio de nutrientes entre el suelo y la planta, promoviendo la fertilidad del suelo y aumentando la eficiencia de los fertilizantes.</p>
<p>En resumen, la Bentonita Organifer es un mejorador de suelo versátil que mejora la gestión del agua del suelo, retiene mejor los nutrientes y activa la vida del suelo, resultando en plantas más saludables y un suelo fértil.</p>"
gid://shopify/Collection/657056596292,semilla-para-cesped-de-sombra,Semilla para Césped de Sombra,"<p>Semilla para Césped de Sombra - Elegante es ideal para crear o reparar un césped en áreas sombreadas. Semilla para Césped de Sombra - Elegante ha sido desarrollada para usuarios que exigen un alto valor ornamental de un césped. La festuca roja utilizada forma un césped denso y de hojas finas. Esta mezcla profesional de semillas de césped también crece bien en la sombra. El césped también es adecuado para condiciones secas y se mantiene erguido cuando se corta corto. El césped ornamental tiene un hermoso color verde y una apariencia elegante.</p>
<p>Un césped perfecto incluso en la sombra<br>Semilla para Césped de Sombra - Elegante contiene tipos de césped que se desempeñan excelentemente incluso con poca luz solar. Incluso en la sombra, crece un hermoso césped. Se previene la formación de musgo y calvas. Además de su alta tolerancia a la sombra, la mezcla de semillas de césped también tiene una alta tolerancia a la sequía. En resumen, es muy versátil para usar como césped ornamental y de sombra.</p>
<p>La solución profesional para céspedes para jardineros paisajistas, específicamente adaptada al usuario exigente en jardines y parques. El uso sofisticado de festuca roja y ryegrass de hojas finas crea un atractivo visual. Alta tasa de éxito en todos los suelos y fácil mantenimiento. La semilla de césped de mayor calidad en el mercado con excelente capacidad de germinación. Rápidamente establece un hermoso césped ornamental que soporta el tráfico frecuente de pies y es duradero. Además, el césped tiene un alto valor ornamental y es fácil de mantener. Muchos jardineros paisajistas usan exclusivamente semillas de césped de Organifer porque brotan rápidamente, se establecen rápidamente, tienen una alta capacidad regenerativa y se ven hermosas.</p>
<p>La mejor opción entre los céspedes de sombra<br>Idealmente adecuado para céspedes ornamentales y jardines decorativos. En la práctica, esta mezcla a menudo se conoce como césped ornamental o de sombra. Dado que la mezcla está compuesta principalmente de céspedes de crecimiento lento y especies de césped que retienen su color verde oscuro durante todo el año, el césped es fácil de mantener. Semilla para Césped de Sombra - Elegante se adapta bien a áreas sombreadas. Forma un césped cerrado que puede ser cortado corto.</p>"
gid://shopify/Collection/657056629060,semilla-para-cesped-deportivo-y-de-juego,Semilla para Césped Deportivo y de Juego,"<p>La Semilla para Césped Deportivo y de Juego - Resiliente contiene la fórmula perfecta para céspedes que soportan un alto tráfico peatonal. Su rápida germinación asegura un césped robusto que se regenera por sí mismo. Originalmente desarrollada para campos deportivos profesionales, es la mezcla de semillas ideal tanto para céspedes deportivos como de juego. También es preferida para sitios de campamento y festivales, parques y cualquier lugar que exija un césped resistente con alta capacidad regenerativa.</p>
<p>Esta mezcla de semillas no solo ofrece alta resistencia al desgaste y un establecimiento rápido, sino también una capacidad regenerativa excepcional. Una vez sembrada, la mezcla se establece rápidamente, llenando cualquier parche estéril. Su composición garantiza un césped denso donde el musgo y las malas hierbas tienen dificultades para desarrollarse.</p>
<p>Los paisajistas profesionales y los administradores de campos deportivos prefieren la Semilla para Césped Deportivo y de Juego - Resiliente. Su rápido crecimiento y establecimiento, junto con su estética atractiva, la hacen destacar. El contenido significativo de ryegrass fino en la mezcla asegura una colocación suave. Mientras tanto, la adición de festuca de prado resulta en un césped increíblemente resistente.</p>"
gid://shopify/Collection/657056661828,mejorador-de-suelo-activador,Mejorador de Suelo Activador,<p>Este acondicionador de suelo que contiene hongos y bacterias vivas (incluyendo bacilo de Micorriza) estimula y activa el ecosistema del suelo. El mejorador de suelo definitivo basado en una mezcla de humus de lombriz y estiércol de vaca seco enriquecido con minerales y elementos traza provenientes del polvo de roca volcánica.</p>
gid://shopify/Collection/657056694596,alimento-para-plantas-todo-en-uno-organifer,Alimento para Plantas Todo-en-Uno Organifer,"<p>El Alimento para Plantas Todo-en-Uno de Organifer es un fertilizante completo universalmente aplicable para todas las plantas de interior, plantas en macetas, plantas de patio y balcón, pero también se utiliza ampliamente en el cultivo orgánico de vegetales, frutas, hierbas, y en la fertilización líquida de céspedes y jardines ornamentales. Este fertilizante universal orgánico asegura un crecimiento saludable y un rendimiento óptimo.</p>"
gid://shopify/Collection/657056727364,mezcla-para-escarificar,Mezcla para Escarificar,"<p>Organifer Renovación de Césped es la mezcla perfecta para transformar un césped débil y delgado en uno completo, fuerte y verde. La mezcla profesional para la reparación y regeneración del césped proporciona un césped verde denso y saludable dentro de un mes después de escarificar el césped. Los resultados y la conveniencia provienen de la combinación de semillas de césped de alta calidad, fertilizantes y un mejorador de suelo. Todo mezclado en la proporción óptima en una bolsa resistente, esta mezcla garantiza el éxito de un solo intento. No es de extrañar que la Renovación de Césped de Organifer haya sido utilizada con éxito por jardineros y consumidores exigentes durante años. Previene las malezas, el musgo y las áreas desnudas; con la Renovación de Césped de Organifer, estás eligiendo un césped saludable, denso y de verde oscuro.</p>"
gid://shopify/Collection/657056792900,fertilizante-de-sulfato-de-hierro,Fertilizante de Sulfato de Hierro,"<p>Fertilizante de sulfato de hierro para un césped denso y verde exuberante sin musgo. También es adecuado para proporcionar hierro a otras plantas del jardín. El alto contenido de hierro contribuye a una mejor competitividad del césped contra el musgo y las malezas no deseadas. El sulfato de hierro juega un papel crucial en la fotosíntesis de las plantas (de césped). El fertilizante asegura que las plantas absorban la luz solar de manera efectiva, aumentando su resistencia y previniendo fácilmente la aparición de enfermedades en las hojas.</p>"
gid://shopify/Collection/657056858436,mezclas-de-semillas-de-flores,Mezclas de Semillas de Flores,"<p>Las mezclas de semillas de flores ofrecen la solución ideal para transformar su jardín o espacio público en un oasis de belleza. Con nuestra amplia selección de semillas de flores, garantizamos una exhibición deslumbrante de colores y una fragancia inolvidable. Nuestras mezclas de flores están meticulosamente seleccionadas e incluyen solo las especies de flores nativas y de la mejor calidad.</p>
<p>Estas mezclas de flores contribuyen al aumento de la biodiversidad y apoyan la supervivencia de diversas especies de insectos y animales. Además, mejoran la calidad del suelo al aportar materia orgánica y nutrientes a la tierra. Las mezclas de flores de Organifer son fáciles de mantener, ofreciendo un espléndido espectáculo floral con un esfuerzo mínimo. Aseguramos productos exclusivamente ecológicos y naturales, permitiéndole disfrutar de la belleza natural sin preocupaciones.</p>"
gid://shopify/Collection/657056923972,bolas-nutritivas-em-para-estanques-con-nutricion-para-plantas,Bolas Nutritivas EM para Estanques con Nutrición para Plantas,"<p>Las plantas de estanque juegan un papel crucial en su estanque, no solo como elementos decorativos, sino también para mantener el agua clara y limpia. Por lo tanto, el crecimiento saludable de sus plantas de estanque es esencial para prevenir el crecimiento de algas y proteger a los animales acuáticos.</p>
<p>Para mantener sus plantas saludables, las Bolas Nutritivas EM de Organifer ofrecen la solución perfecta. Estas bolas no solo contienen elementos macro y micro para los nutrientes adecuados, sino que también aseguran una liberación controlada para evitar la sobrealimentación o la alimentación insuficiente. Además, las bolas nutritivas no solo estimulan el crecimiento de sus plantas, sino también su resistencia a enfermedades y plagas.</p>
<p>Las Bolas Nutritivas EM son fáciles de usar y adecuadas para todo tipo de plantas de estanque. Puede simplemente colocarlas en una canasta con las plantas, insertarlas en el sustrato de un filtro, o lanzarlas entre un grupo de plantas acuáticas en el estanque. Inmediatamente se hunden hasta el fondo y liberan lentamente nutrientes para que sus plantas permanezcan saludables y nutridas durante todo el año.</p>"
gid://shopify/Collection/657056956740,polvo-de-tierra-de-diatomeas,Polvo de tierra de diatomeas,"<p>La tierra de diatomeas es ampliamente reconocida como un método seguro y efectivo para combatir diversos tipos de plagas. Esto incluye hormigas, pececillos de plata, avispas, chinches, tijeretas, pulgas, piojos, ácaros, cucarachas, cochinillas, ácaros rojos, ácaros de las aves, áfidos, larvas de polilla de la harina, mosquitos de los hongos, trips y otros insectos dañinos. La Tierra de Diatomeas de Organifer es versátil, completamente natural, inodora y adecuada tanto para uso interior como exterior.</p>
<p>La tierra de diatomeas funciona a través de un proceso mecánico, donde las partículas microscópicas perforan la capa protectora de cera de los insectos, deshidratándolos y, posteriormente, matándolos. Sin embargo, es crucial tener en cuenta que la tierra de diatomeas no es selectiva y puede matar a todos los insectos que entren en contacto con ella, incluidos los beneficiosos. Por lo tanto, es esencial aplicar el polvo de manera meticulosa y estratégica para evitar daños no deseados. Permanece efectiva mientras esté seca y no sea perturbada. La tierra de diatomeas es inofensiva para los humanos y los animales, lo que la convierte en una alternativa frecuentemente elegida a los pesticidas químicos.</p>"
gid://shopify/Collection/657057022276,semillas-de-huerta,Semillas de huerta,"<p>¿Te gustaría disfrutar de productos frescos y saludables directamente de tu propio jardín?</p>
<p>Nuestros Kits de Semillas para Huerto contienen una colección meticulosamente curada de variedades esenciales y culinarias de verduras, frutas y hierbas que son adecuadas para cualquier huerto de cocina. Cada variedad de semilla está cuidadosamente seleccionada por su facilidad de cultivo y adecuación para diferentes estaciones, asegurando una cosecha abundante. Las semillas están empaquetadas en sobres convenientes, facilitando el almacenamiento y organización de tu colección.</p>
<p>Además de las semillas, nuestros kits de semillas también incluyen descripciones completas en cada paquete. Encontrarás consejos útiles sobre preparación del suelo, cosecha y almacenamiento, entre otras cosas. Esta información facilita que tanto jardineros novatos como experimentados aprovechen al máximo su huerto de cocina.</p>
<p>Ponemos un gran énfasis en la salud y seguridad de nuestros clientes y el medio ambiente. Por eso, nuestras semillas están libres de tratamiento químico y comprenden exclusivamente variedades registradas en el Reino Unido y cepas no modificadas genéticamente (No OGM). Por lo tanto, puedes estar seguro de que recibirás semillas de la más alta calidad, saludables y seguras.</p>"
