ID,Handle,Title,DescriptionHTML
gid://shopify/Collection/657058627908,kuivuutta-kestava-ruohonsiemen,Kuivuutta kestävä ruohonsiemen,"<p>Kuivuudenkestävä nurmikon siemenseos takaa vahvan ja kestävän nurmikon, joka pysyy vihreänä ja terveenä myös kuumina kesinä ja pitkien kuivien jaksojen aikana. Syväjuuristen nurmikasvilajikkeiden ansiosta nurmikko pystyy hyödyntämään vettä ja ravinteita syvemmistä maakerroksista, jolloin se on vähemmän riippuvainen kastelusta. Tuloksena on helppohoitoinen nurmikko, joka palautuu nopeasti käytön jälkeen ja kestää kovaa kulutusta.</p>
<p>Tämän hellettä ja kuivuutta sietävän siemenseoksen avulla luot kestävän nurmikon, joka pysyy tiheänä, vahvana ja värinsä säilyttävänä vuodesta toiseen. Ihanteellinen kotipihoihin, leikkialueille ja urheilukentille, joissa tarvitaan suorituskykyä ja syvänvihreää ulkonäköä myös ääriolosuhteissa.</p>"
gid://shopify/Collection/657058660676,paddock-ruohon-siemenet,Paddock-ruohon siemenet,"<p>Paddock-nurmikon siemenseos on kehitetty erityisesti kestäviä ja vahvoja hevoshakoja varten. Nopea itävyys muodostaa tiheän ja kimmoisan nurmikon, joka kestää intensiivistä laiduntamista, laukkaa ja kavioiden kulutusta. Matalien kasvupisteiden ansiosta nurmikko palautuu nopeasti, eikä paljaille paikoille tai rikkaruohoille jää tilaa.</p>
<p>Tämä maittava siemenseos tuottaa ravinteikasta ja terveellistä nurmikkoa, joka sopii erinomaisesti päivittäiseen laiduntamiseen ja on turvallinen hevosille. Paddock-nurmikon siemenseoksella luot vahvan ja vihreän laitumen, joka takaa tasaisen rehunsaannin ja tukee hevostesi terveyttä sekä hyvinvointia.</p>"
gid://shopify/Collection/657058693444,heina-ja-sailorehun-siemenseos,Heinä- ja säilörehun siemenseos,"<p>Organifer Hay on korkealaatuinen siemenseos, joka on kehitetty erityisesti niittoon sekä heinän ja säilörehun tuotantoon. Seos tuottaa jopa 30 % enemmän satoa hehtaarilta verrattuna tavallisiin heinäseoksiin ja muodostaa kestävän nurmipinnan, joka pysyy tuottavana vuosien ajan.</p>
<p>Tasapainoisen koostumuksensa – sisältäen muun muassa timoteita, nurminataa ja nurmipuntarpäätä – ansiosta seos tuottaa kuitupitoista ja aromaattista heinää, jossa on matala fruktaanipitoisuus. Tämä tekee karkearehusta turvallista hevosille ja vähentää kaviokuumeen sekä ylipainon riskiä. Hevoset syövät heinän mielellään loppuun asti, ja sen tasainen ravintoarvo tukee tervettä ruoansulatusta.</p>
<p>Organifer Hay erottuu edukseen korkealla rehuarvollaan, nopealla kuivumisellaan niiton jälkeen sekä pitkäaikaisella vakaudellaan. Lopputuloksena on ensiluokkaista karkearehua omalta pellolta: maittavaa, turvallista ja tuottavaa – satokaudesta toiseen.</p>"
gid://shopify/Collection/657058955588,sedum-ja-viherkattojen-lannoite,Sedum- ja viherkattojen lannoite,"<p>Organifer Sedum- ja viherkattojen lannoite on erikoistunut orgaanis-mineraalinen lannoite, joka on suunniteltu optimoimaan sedum- ja viherkattojen kasvu, tiheys ja elinvoimaisuus. Tähän kategoriaan kuuluvat tuotteet on kehitetty pitämään katot rehevinä, vahvoina ja terveinä pitkällä aikavälillä samalla kun ne kunnioittavat katon ekosysteemin luonnollista tasapainoa. Lannoite edistää tasaista ja pitkäkestoista kasvua, luoden tiheän, täyteläisen ja elinvoimaisen sedum-maton.</p>
<p>Tasapainoinen NPK-koostumus on suunniteltu erityisesti sedumille ja muille mehikasveille. Lisätyn kaliumin ansiosta lannoite parantaa kasvien kestävyyttä kuivuutta, kuumuutta ja äärimmäisiä sääolosuhteita vastaan. Se estää paljaiden kohtien ja sammaleen muodostumista vakaan, hallitun ravinteiden vapautumisen ansiosta. Lisäksi se vahvistaa juuristoa, mikä parantaa katon kasvualustan kestävyyttä ja vakautta.</p>
<p>Terve kasvillisuuskerros tukee luonnon monimuotoisuutta houkuttelemalla mehiläisiä, perhosia ja muita hyödyllisiä hyönteisiä. Ympäristöystävällinen koostumus on täysin biohajoava ja tarjoaa pitkäkestoisia tuloksia ravinteiden asteittaisen vapautumisen kautta. Tuote on helppokäyttöinen ja soveltuu sekä laajoille että intensiivisille viherkatoille.</p>"
gid://shopify/Collection/657059053892,kukkalannoite,Kukkalannoite,"<p>Organifer Kukkalannoite on erityisesti kehitetty tukemaan kukkivia kasveja optimaalisesti koko kasvukauden ajan. Tasapainoinen koostumus edistää vahvaa juuriston kehitystä, mikä mahdollistaa ravinteiden tehokkaamman imeytymisen ja uusien kukkanuppujen muodostumisen. Tämä johtaa runsaampaan, täyteläisempään ja pitkäkestoisempaan kukintaan. Lisäksi kukkalannoite vahvistaa kasvien luonnollista vastustuskykyä, jolloin ne ovat vähemmän alttiita stressille, kuivuudelle ja sienipaineelle. Soveltuu yksi- ja monivuotisille lajeille, kukkareunoihin, ruukkuihin, parvekkeille ja koristepuutarhoihin. Se on ihanteellinen valinta kaikille, jotka haluavat saavuttaa maksimaalisen värikylläisyyden ja runsaan kukinnan.</p>"
gid://shopify/Collection/657059119428,huonekasvilannoite,Huonekasvilannoite,"<p>Organifer Huonekasvilannoite on huolellisesti koostettu vihreiden ja kukkivien huonekasvien tarpeisiin. Huonekasveilla on rajallinen pääsy luonnollisiin ravinteisiin, joten kohdennettu lannoitus on välttämätöntä. Tämä lannoite edistää vahvan juuriston kehittymistä, kiiltäviä lehtiä sekä tasaista ja tervettä kasvua. Hellävarainen koostumus ehkäisee ylilannoitusta ja sopii erinomaisesti herkille kasveille, kuten calathealle, alocasialle, monsteralle ja fikukselle. Lisäksi ravinteet parantavat kasvien vastustuskykyä yleisiä sisäkasviongelmia vastaan, kuten kuivaa ilmaa, vähäistä valoa ja juuristostressiä. Ihanteellinen sekä aloittelijoille että kokeneille kasviharrastajille, jotka haluavat nähdä viherkeitaansa kukoistavan.</p>"
gid://shopify/Collection/657059152196,mehikasvilannoite,Mehikasvilannoite,"<p>Organifer Mehikasvilannoite on erityisesti suunniteltu mehikasvien, kaktusten ja aavikkokasvien ainutlaatuisiin ravinnetarpeisiin. Nämä kasvit kasvavat hitaasti ja tarvitsevat kevyen, tasapainoisen lannoitteen, joka säilyttää lehtien rakenteen ja ehkäisee ylilannoitusta. Lannoite stimuloi kompaktia kasvua, kirkkaita värejä ja vahvoja lehtiä, jotka varastoivat vettä tehokkaasti. Lisäksi se tukee tervettä juuriston kehitystä, mikä on erityisen tärkeää juurimädälle herkille kasveille. Täydellinen valinta aloe veralle, echeverialle, haworthialle, anopinkielille, kaktuksille ja muille kuivuutta sietäville kasvilajeille niin sisällä kuin ulkona.</p>"
gid://shopify/Collection/657059250500,vihanneslannoite,Vihanneslannoite,"<p>Organifer Vihanneslannoite on kehitetty tarjoamaan kasvimaiden kasveille niiden tarvitsemat ravinteet voimakkaaseen kasvuun ja runsaisiin satoihin. Se stimuloi terveiden lehtien, vahvan juuriston ja kiinteiden hedelmien kehittymistä. Tasapainoisen typen, fosforin ja kaliumin suhteen ansiosta vihanneskasvit saavat tukea kaikissa kasvuvaiheissa taimesta sadonkorjuuseen. Tämä lannoite sopii erinomaisesti tomaateille, kurkuille, paprikoille, kesäkurpitsoille, kaaleille, lehtivihanneksille ja juureksille. Lisäksi vihanneslannoite parantaa maan rakennetta ja maaperän mikrobitoimintaa, mikä edistää kestävää ja tuottavaa kasvimaata.</p>"
gid://shopify/Collection/657059381572,nurmen-lannoite,Nurmen lannoite,"<p>Organifer Nurmilannoite on suunniteltu vahvan, vihreän ja tasaisen nurmikon luomiseen ja ylläpitämiseen. Se tukee tiheää juuriston kasvua, mikä lisää nurmen kestävyyttä kulutusta, kuivuutta ja lämpötilavaihteluita vastaan. Lannoite edistää syvänvihreää väriä, vähentää paljaita laikkuja ja auttaa sammaloitumisen ja rikkakasvien torjunnassa. Ihanteellinen koriste-, piha- ja pelinurmikoille sekä intensiivisessä käytössä oleville nurmialueille. Tasapainoisen koostumuksensa ansiosta nurmikko pysyy hyvin ravittuna ja elinvoimaisena pitkään, jopa haastavissa kasvuolosuhteissa.</p>"
gid://shopify/Collection/657059414340,yrttilannoite,Yrttilannoite,"<p>Organifer Yrttilannoite tarjoaa aromaattisille yrteille mietoja, luonnollisia ravinteita, jotka parantavat makua, tuoksua ja lehtien laatua. Monet yrtit kasvavat luonnostaan melko köyhässä maassa ja tarvitsevat tasapainoisen lannoitteen, joka tukee kompaktia kasvua ja runsasta aromin kehitystä ilman liiallista kasvuun pakottamista. Tämä lannoite sopii erinomaisesti basilikalle, mintulle, oreganolle, timjamille, salvialle, persiljalle ja muille välimerellisille tai lehtisatoa tuottaville yrteille. Ravinteet tukevat voimakasta juuriston kehitystä ja tervettä kasvurakennetta, auttaen yrttejä pysymään tuoreina ja satoisina pidempään.</p>"
gid://shopify/Collection/657059479876,hedelmalannoite,Hedelmälannoite,"<p>Organifer Hedelmäkasvilannoite tarjoaa välttämättömät ravinteet, joita hedelmäpuut, marjapensaat ja muut pehmeitä hedelmiä tuottavat kasvit tarvitsevat kukinnan muodostumiseen, hedelmien asettumiseen ja maun kehittymiseen. Lannoite tukee vahvaa juuristoa, tervettä lehtikasvua sekä mehukkaiden ja aromaattisten hedelmien tuotantoa. Soveltuu muun muassa mansikoille, vadelmille, karhunvatukoille, pensasmustikoille, viinirypäleille, omena- ja päärynäpuille sekä sitruskasveille. Hedelmäkasvilannoite lisää kasvien luonnollista vastustuskykyä tauteja ja stressitekijöitä vastaan, auttaen kasveja pysymään elinvoimaisina ja satoisina koko kasvukauden ajan.</p>"
gid://shopify/Collection/657059578180,puunlannoite,Puunlannoite,"<p>Organifer Puunlannoite on erityisesti koostettu tukemaan sekä nuoria että varttuneita puita terveeseen kasvuun. Ravinteet tunkeutuvat syvälle maaperään ja stimuloivat voimakasta juuriston laajenemista, mikä on välttämätöntä puun vakaudelle, veden­imukyvylle ja pitkäaikaiselle elinvoimalle. Lisäksi lannoite edistää tukevien oksien, terveen lehvästön ja vahvan puustorakenteen kehittymistä. Soveltuu koristepuille, katu- ja puistopuille, hedelmäpuille sekä välimerellisille lajeille, kuten oliivipuille. Puunlannoite auttaa puita toipumaan leikkauksesta, stressistä, kuivuudesta ja köyhästä maaperästä, ja tukee tervettä ja kestävää kasvukautta.</p>"
gid://shopify/Collection/657060331844,mustasotilaskarpasen-hyonteisjate,Mustasotilaskärpäsen hyönteisjäte,"<p>Organiferin hyönteisten jätelannoiterakeet valmistetaan 100 % puhtaista hyönteisten jätöksistä, jotka ovat peräisin mustasotilaskärpäsen toukista. Tämä korkealaatuinen tuote valmistetaan Alankomaissa, kuivataan ja hygienisoidaan lämmittämällä ja puristetaan sitten ainutlaatuisiksi mikrorakeiksi.</p>
<p>Organiferin hyönteisten jäte on erittäin runsas kitiinipitoisuudeltaan. Kitiini on superruokaa mikro-organismeille, jotka hajottavat sen. Tämän prosessin aikana vapautuu entsyymejä (kitiinaaseja), jotka saavat kasvin aktivoimaan luonnolliset puolustusmekanisminsa. Tämä tekee kasvista vähemmän alttiin taudeille ja tuholaisille. Ei ole ihme, että Organiferin hyönteislannoitetta käytetään menestyksekkäästi puutarhaviljelyalalla.</p>"
gid://shopify/Collection/657060528452,lannoite-tabletit-all-in-one,Lannoite Tabletit All-In-One,"<p>Nämä All-In-One lannoitetabletit, joissa on rhizobakteereja, on kehitetty erityisesti ravitsemaan kasveja optimaalisesti ympäri vuoden. Hitaasti vapautuva teknologia, joka vapauttaa makro- ja mikroravinteita hallitusti, rakentaa kasvin ja varmistaa ravinnetasapainon, joka estää yli- tai alilannoituksen. Näin kasvi saa juuri sen, mitä se tarvitsee terveeseen kasvuun ja kukintaan.</p>
<p>Organifer All-In-One -tablettien ansiosta sinun ei enää tarvitse huolehtia kasvien hoidosta. Nämä tabletit sisältävät sekä makro- että mikroravinteita, jotka ovat välttämättömiä terveelle kasvien kasvulle. Niiden hallittu vapautus varmistaa tasapainoisen ravinteiden saannin, mikä on tarpeen terveemmille ja elinvoimaisemmille kasveille.</p>
<p>Lisätyt rhizobakteerit ja fulviinihappo parantavat tuloksia entisestään kiinnittämällä typpeä ja mobilisoimalla ravinteita kasville. Ne myös lisäävät klorofyllipitoisuutta ja hajottavat orgaanisia aineita, mikä edistää kasvien terveyttä ja kukintaa.</p>
<p>Oikein käytettynä Organifer All-In-One lannoitetabletit ovat yksinkertainen, taloudellinen ja kustannustehokas ratkaisu uusien ja olemassa olevien kasvien lannoitukseen. Nämä lannoitetabletit ovat ihanteellisia ruukku-, amppeli- ja säiliökasveille, ja ne sisältävät kaiken, mitä kasvisi tarvitsevat terveeseen kasvuun ja kukintaan ympäri vuoden.</p>"
gid://shopify/Collection/657535631684,maanparannusaineet,Maanparannusaineet,"<p>Intensiivisen käytön vuoksi maaperämme laatu on jatkuvasti paineen alla. Vuosikymmeniä jatkunut vain muutamaan elementtiin rajoittuva keinolannoitteiden käyttö on köyhdyttänyt maaperää. Mineraalinen hedelmällisyys vähenee, ja maaperän humuspitoisuus, rakenne sekä taudinkestävyys heikkenevät. Tämän seurauksena kasvien vastustuskyky heikkenee, ja ruokamme on menettänyt osan välttämättömistä mineraaleista ja hivenaineista.</p>
<p>Pelkästään keinolannoitteiden, kalkin ja orgaanisen aineksen käyttö ei pysty palauttamaan maaperää kestävällä tavalla. Kivipölyn käyttö luonnollisena mineraalilähteenä maaperän hedelmällisyyden lisäämiseksi on tunnettu pitkään, mutta se on jäänyt vähälle huomiolle modernien synteettisten lannoitteiden käytön vuoksi.</p>
<p>Organifer on vuodesta 2009 lähtien sitoutunut kestävän maaperän laadun palauttamiseen.</p>"
gid://shopify/Collection/657535664452,nestemainen-lannoite,Nestemäinen lannoite,"<p>Organifer nestemäinen lannoite on käytössä menestyksekkäästi hydroponiikassa ja substraattiviljelyssä, sisällä ja ulkona, maataloudessa, golf- ja urheilukentillä, koriste- ja vihannespuutarhoissa sekä huonekasveille.</p>"
gid://shopify/Collection/657535697220,sairaudet-ja-tuholaiset,Sairaudet ja tuholaiset,"<p>Ympäristöystävällinen ja kestävä ratkaisu laajaan valikoimaan kasvien ja puutarhan ongelmia. Tiivisteemme koostuvat yksinomaan kasvipohjaisista ainesosista, jotka imeytyvät maaperään ja kasvien juuriin. Siellä ne stimuloivat kasvien kasvua, elinvoimaa ja luonnollisia uudistumiskykyjä, korjaten epätasapainoja ja ulkoisia tekijöitä, jotka vaikuttavat kasveihin.</p>
<p>Ymmärrys siitä, että kasveja voidaan suojata ja vahvistaa huomioimalla luonnollinen kiertokulku ja symbioottiset suhteet, on ollut pitkään tunnustettu. Organifer on kehittänyt tätä periaatetta eteenpäin ja hyödyntää erityisiä yrttiuutteita luodakseen tehokkaan ratkaisun, jota voidaan käyttää sekä ennaltaehkäisevästi että parantavasti.</p>"
gid://shopify/Collection/657535729988,orgaaninen-lannoite,Orgaaninen lannoite,"<p>Orgaaninen lannoite sopii erinomaisesti peruslannoitteeksi koristepuutarhoihin, reunuksiin, nurmikoille, sipuli- ja mukulakasveille, vihannespuutarhoihin, ruusuille, ruukkukasveille ja hedelmäpuille. Rakeet parantavat maaperän rakennetta ja vedenpidätyskykyä, mahdollistavat hedelmällisen maaperän elämän ja rikastavat maaperää luonnollisesti ylläpitäen jatkuvaa tasapainoa. Tämä yleislannoite sopii kaikille maaperätyypeille ja soveltuu täydellisesti peruslannoitteeksi nurmikoille, reunoille, vihannespuutarhoihin, laitumille ja hedelmätarhoihin. Lisäksi rakeet toimivat maaperän aktivaattorina stimuloimalla nopeasti positiivista maaperän elämää.</p>"
gid://shopify/Collection/657535762756,lannoitetabletit,Lannoitetabletit,"<p>Nämä All-In-One lannoitetabletit, joissa on Rhizobakteereja, on erityisesti kehitetty ravitsemaan kasveja optimaalisesti ympäri vuoden. Hitaasti vapautuva teknologia, joka vapauttaa makro- ja mikroravinteita annoksina, parantaa kasvin rakennetta ja varmistaa ravinteiden tasapainon, joka estää yli- tai alilannoituksen. Näin kasvi saa juuri sen, mitä se tarvitsee terveeseen kasvuun ja kukintaan.</p>
<p>Organifer All-In-One -tablettien ansiosta sinun ei enää tarvitse huolehtia kasvien hoidosta. Nämä tabletit sisältävät sekä makro- että mikroravinteita, jotka ovat välttämättömiä terveelle kasvien kasvulle. Annosmainen vapautus varmistaa tasapainoisen ravinteiden saannin, mikä on tarpeen terveemmille ja elinvoimaisemmille kasveille.</p>
<p>Lisätyt Rhizobakteerit ja Fulviinihapot tehostavat näitä tuloksia kiinnittämällä typpeä ja mobilisoimalla ravinteita kasville. Ne myös lisäävät klorofyllipitoisuutta ja hajottavat orgaanisia aineita, mikä hyödyttää kasvien terveyttä ja kukintaa.</p>
<p>Oikein käytettynä Organifer All-In-One lannoitetabletit ovat yksinkertainen, taloudellinen ja kustannustehokas ratkaisu uusien ja olemassa olevien kasvien lannoitukseen. Nämä lannoitetabletit ovat ihanteellisia ruukku-, amppeli- ja säiliökasveille, ja ne sisältävät kaiken, mitä kasvisi tarvitsevat terveeseen kasvuun ja kukintaan ympäri vuoden.</p>"
