ID,Handle,Title,DescriptionHTML
gid://shopify/Collection/657055711556,levelbetegsegek-koncentratum,Levélbetegségek koncentrátum,"<p>A Levélbetegségek Koncentrátum egy specifikus hatású (nem mérgező) gyógynövény-kivonatokból álló keverék, amely ellenállóvá teszi a növényeket a levélgombák és levélfoltok ellen. Ide tartozik a lisztharmat és a peronoszpóra, rozsda, levélfolt betegség és feketefolt, valamint a fű- és levélgombák. Alkalmas díszkert, zöldségkert és park növényeihez, ahol a gyengébb talaj és a gyengébb növényi ellenállás miatt levélbetegségek fordulhatnak elő.</p>
<p>A termék támogatja a természetes gyógyulási képességet, gondoskodást, táplálást és megerősítést biztosít a növények számára a külső hatásokkal szemben, a talajban és a gyökereknél. A Levélbetegségek Koncentrátum a növények levelein és gyökerein keresztül szívódik fel. A jelen lévő gyökérserkentő és növénygondozó összetevőknek köszönhetően a növények megnövekedett ellenállóságot és vitalitást fejlesztenek ki. A Levélbetegségek Koncentrátumot legjobban megelőzően érdemes alkalmazni, különösen akkor, ha a múltban jelentős problémák és károk merültek fel.</p>"
gid://shopify/Collection/657055744324,bazalt-agyag-talajjavito,Bazalt agyag talajjavító,"<p>A Basalt Meal Soil Improver for Clay Soil rendkívül alkalmas a vályogtalajok javítására. A Basalt Meal Soil Improver for Clay Soil kiemelkedően magas elektromágneses értékekkel rendelkezik. Reagál a vályog-humus komplexummal, ami a vályog morzsolódását eredményezi. Megszünteti a vályog részecskék közötti összeköttetést, ami könnyebben megmunkálható és lazább talajt eredményez. Ezenkívül a bazaltliszt pozitív tulajdonsága a nitrogén megkötése, megakadályozva annak gyors kimosódását. Röviden, a talaj könnyebben megmunkálható és jobb szerkezetet kap. Magas koncentrációban tartalmaz szilíciumot, meszet, magnéziumot és nyomelemeket, amelyek gazdagítják a talajt. 100% természetes termék, finomra őrölt bazaltból, az Eifel vulkáni kőzetéből származik.</p>"
gid://shopify/Collection/657055777092,diszpazsit-vetomag,Díszpázsit vetőmag,"<p>Ornamental Grass Seed – Elegant azok számára készült, akik magas esztétikai értéket várnak el gyepüktől. A felhasznált finom fűfélék sűrű és vékony levelű gyepet biztosítanak. Ez a professzionális fűmagkeverék jól fejlődik száraz körülmények között, és robusztus marad rövidre nyírva. A gyep gazdag zöld árnyalatot mutat, elegáns megjelenéssel. A finom fűfélék sűrű és vékony levelű fedést biztosítanak.</p>
<p>Különösen alkalmas díszkertekhez és díszgyephez. Ezt a keveréket a gyakorlatban gyakran dísz- vagy árnyékgyepnek nevezik. Főként lassan növő fűtípusokból és fajtákból áll, amelyek megőrzik mély zöld színüket az év minden szakaszában, így alacsony karbantartást igényel. Az Ornamental Grass Seed – Elegant jól alkalmazkodik az árnyékos területekhez, zárt gyepfedezetet képez, és rövidre nyírható.</p>"
gid://shopify/Collection/657055809860,lavaszemcsek,Lávaszemcsék,"<p>Az Organifer primeval rock lava grit a piacon elérhető legmagasabb minőségű vulkáni grits. Ez a talajjavító anyag a legmagasabb ásványi anyag koncentrációval és a legjobb feldolgozási képességekkel büszkélkedhet. Sokoldalú, és kiválóan alkalmas szétszórásra vagy keverésre. Széles körben használják kertekben talajjavítóként, és ez a tápanyagban gazdag vulkáni grits közvetett hatásokat gyakorol a zsombékfélék és más gyomok ellen is. Nagyon magas pórus térfogata van, és javítja a talaj állapotát a tömörült talajokban. Fokozza a talaj szerkezetét, a víz- és levegőtartalmat, a gyökér áthatolást, valamint a talaj ásványi anyagainak elérhetőségét. A lava grits széles körben és sikeresen alkalmazzák kertekben, mezőgazdaságban, sportpályákon, erdőgazdálkodásban és faiskolákban.</p>"
gid://shopify/Collection/657055973700,gyep-javitas-vetomag,Gyep javítás vetőmag,"<p>A Gyepjavító Mag – Ellenálló az ideális helyreállító formulát tartalmazza minden típusú gyep felújításához és újravetéséhez. Szupergyors csírázása és a meglévő fűben való megerősödése, valamint óriási versenyképessége garantálja a Gyors Helyreállítást. Gyorsan kitölti a kopár és nyitott foltokat. Az eredmény egy teljes átalakulás, elérhető költségek mellett, amely minden gyepet újjá varázsol.</p>
<p>A Gyepjavító Mag – Ellenálló a magas lábforgalmi toleranciát és a gyors megerősödést kombinálja a kiváló újranövekedési képességgel. Ez a fűmagkeverék gyorsan csírázik, megerősödik és helyreáll. A Gyepjavító Mag – Ellenálló sűrű gyepet biztosít, ahol a mohának és a gyomoknak nincs esélye. Ez egy professzionális minőségű fűmagkeverék, amely különösen alkalmas a gyep utólagos vetésére a gyepfésülés után. Gyors csírázása lehetővé teszi, hogy gyorsan lefedje a kopár foltokat. Számos kertész és sportpálya kezelő folyamatosan választja a Gyepjavító Mag – Ellenálló formulát rendkívül gyors megjelenése és megerősödése, magas újranövekedési képessége, valamint vonzó megjelenése miatt. A finom angol rozs fű jelentős része sima lerakást biztosít, míg a réti fűvel való kombináció különösen robusztus gyepet eredményez.</p>"
gid://shopify/Collection/657056039236,csirketragya-pellet,Csirketrágya pellet,"<p>Az Organifer Csirketrágya Pelleták tökéletes megoldást kínálnak minden kertész számára, aki egészséges és termékeny talajt keres. Ezek a pelleták 100%-ban tiszta csirketrágyából készülnek, holland farmokról származnak. Fenntarthatóak és költséghatékonyak, így vonzó lehetőséget jelentenek minden kertész számára.</p>
<p>Csirketrágya pelletáinkat hatékony komposztálással szárítják és higiénizálják, megőrizve a tápanyagokat. Ez garantálja, hogy pelletáink mentesek legyenek vírusoktól, kórokozóktól, nem kívánt gombáktól, gyomoktól és baktériumoktól, és folyamatos minőséget és a legmagasabb trágyázási értékeket biztosítsanak minőségromlás nélkül.</p>
<p>Az Organifer Csirketrágya Pelleták nemcsak tápanyagokban, hanem szerves anyagban is gazdagok. A magas szerves anyag tartalom biztosítja a levegős talajt, amely lehetővé teszi a növények mélyebb gyökerezését és a betegségekkel, valamint kártevőkkel szembeni nagyobb ellenállást. Javítja a talajszerkezetet és termékenységet, hozzájárulva a talaj egészségéhez. Ezek a csirketrágya pelleták kiváló vízfelszívó képességgel rendelkeznek, akár a saját súlyuk négyszeresét is képesek nedvességként megtartani. Ez biztosítja, hogy a talaj nedves maradjon, és jól tartsa a vizet, csökkentve az öntözés szükségességét, és így a talaj kevésbé sebezhető a száraz időszakokban.</p>
<p>Az Organifer Csirketrágya Pelleták minden talajtípushoz alkalmasak, és elengedhetetlenek az egészséges és működő talajhoz. Tökéletesek zöldség- és díszkerthez, gyephez, fákhoz és növényekhez. A pelleták könnyen szétszórhatók a földön és a kertben, és nem okoznak port. Válassza az Organifer Csirketrágya Pelletákat, ha fenntartható és költséghatékony megoldást keres a 100%-ban szerves trágyázásra, amely egészséges és termékeny talajt és növényeket eredményez.</p>"
gid://shopify/Collection/657056072004,legelo-vetomag-ret,Legelő Vetőmag rét,"<p>A ""Meadow Grass Seed Meadow - Kifejezetten Lovak és Kisebb Haszonállatok Számára"" egy magas minőségű legelőkeverék, amely alkalmas mind kaszálásra, mind legeltetésre. A keverék válogatott, tanúsított fűmagvakat tartalmaz, beleértve a perenniális rozsot, timothy fűt, réti fűt és sima szárú réti füvet. Ez a kompozíció alkalmassá teszi minden talajtípusra és széleskörű körülmények között történő vetésre.</p>
<p>Ez a fűmag minden talajtípuson termékeny és ízletes marad, különösen legeltetésnél teljesít kiemelkedően. Még kedvezőtlen növekedési körülmények között is jól megállja a helyét. A legelőkeverék magas hozammal és hosszú élettartammal rendelkezik, kifejezetten lovak számára készült, és különféle fűféléket tartalmaz, amelyek alacsony növekedési ponttal és megfelelő struktúrával bírnak a taposás elleni ellenállás érdekében. Nagyon ízletes füvet produkál, amely egészséges fűfélék alacsony cukortartalmú keverékéből áll. Ez a legelőfűmag keverék a juhok, kecskék és hobbiállatok számára is alkalmas.</p>"
gid://shopify/Collection/657056170308,szaritott-tehentragya,Szárított tehéntrágya,"<p>Az Organifer Prémium Szárított Tehéntrágya 100%-ban tiszta és friss tehéntrágyából készül. A higiénizált tehéntrágya, körülbelül 55% szárazanyag tartalommal, gazdag alapvető tápanyagokban a tökéletes eredmény érdekében. A magas szerves anyag arány, a megfelelő ásványi anyagokkal, huminsavakkal és nyomelemekkel kombinálva, a tehéntrágyát a tökéletes univerzális trágyává és talajjavítóvá teszi.</p>
<p>Ez a holland minőségű termék a holland farmokon komposztálással szárítják és higiénizálják, elkerülve a felesleges szállítást, és biztosítva a friss trágya felhasználását veszteségek nélkül. Az egyedi komposztálási módszer garantálja a folyamatos minőséget a legmagasabb trágyázási értékekkel és egy tökéletes végterméket, amely garantáltan teljesen mentes vírusoktól, kórokozóktól, nem kívánt gombáktól, gyomoktól és baktériumoktól. Kiválóan alkalmas gyephez, díszkertekhez, virágágyásokhoz, hagymás és gumós növényekhez, zöldségkertekhez, rózsákhoz, cserepes növényekhez, gyümölcsfákhoz és legelőkhez. Ez a szárított trágya 100%-ban tiszta és friss tehéntrágya, amely komposztálással szárad. A magas szerves anyag tartalom miatt javítja a talajszerkezetet és a vízmegtartó képességet, elősegíti a termékeny talajkörnyezetet, és természetes módon gazdagítja a talajt a hosszú távú egyensúly fenntartása érdekében.</p>"
gid://shopify/Collection/657056268612,algamesz-lithothamnium-calcareum,Algamész - Lithothamnium calcareum,"<p>Az Organifer Algae Lime 100%-os tisztaságú Lithothamnium calcareum (vörös alga) mészből származik, amely egy fenntartható természetes termék, és az Atlanti-óceánból származik. A többi márkától megkülönböztetve az Organifer Algae Lime hígítatlan marad, garantálva tisztaságát. Bár lehet, hogy nem ez a legköltséghatékonyabb algamész opció, a legmagasabb minőséggel büszkélkedhet és teljesen tiszta. Ennek következtében figyelemre méltó hatékonyságot mutat. Az Organifer algamész egyedülálló és optimális tápanyagprofilja egészséges növényeket és termékeny talajt eredményez.</p>"
gid://shopify/Collection/657056334148,lisztkukac-frass-tragya-pellet,Lisztkukac Frass trágya pellet,"<p>Az Organifer lisztkukac trágya pelletjei 100% tiszta ürülékből (rovarürülék) készülnek lisztkukac bogaraktól. Ez egy kiváló minőségű termék, amelyet Hollandiában gyártanak, hőkezeléssel szárítanak és fertőtlenítenek, majd egyedi mikro-pelletekbe préselnek. Az Organifer lisztkukac trágya pelletek szinte szagtalanok, így beltéri növényekhez is alkalmasak.</p>
<p>Az Organifer lisztkukac ürülék trágya pelletek NPK értéke 4-2-2, és magas kitintartalommal rendelkezik. Ezenkívül a termék gazdag ásványi anyagokban, nyomelemekben és szerves anyagban. Ez a sokoldalú trágya tartalmazza az összes tápanyagot, amely szükséges mind a gyep, mind a növények számára. Mivel az Organifer ürülék 100% organikus, a tápanyagok kontrollált módon szabadulnak fel, és nem mosódnak ki. Az Organifer rovartrágya használatával javul a növények és a talaj növekedése, virágzása és ellenálló képessége.</p>"
gid://shopify/Collection/657056563524,bentonit-homokos-talajjavito,Bentonit homokos talajjavító,"<p>Az Organifer Bentonite tökéletes talajjavító könnyű homokos talajokhoz. Ezek a természetes kőzetből származó expandált agyagmikro-minerálok különösen alkalmasak a homokos talaj szerkezetének és kohéziójának javítására. Ennek következtében a homokos talaj könnyebben megmunkálható, és a talajszerkezet jelentősen javul az alkalmazás során.</p>
<p>De ez még nem minden! Az Organifer Bentonite javítja a talaj vízkezelését és megakadályozza a trágyák kimosódását. Ennek oka nagy felszívóképessége, amely lehetővé teszi, hogy a saját súlyának akár 10-szeresét is vízben képes felszívni. Így a talaj kevésbé szárad ki, és a nedvesség hosszabb ideig elérhető marad a növények számára, még száraz nyarak alatt is.</p>
<p>Az Organifer Bentonite pozitív hatással van a tápanyagok tárolására és megakadályozza a kimosódást. Aktiválja a talaj életét és fokozza a tápanyagok cseréjét a talaj és a növény között, elősegítve a talaj termékenységét és növelve a trágyák hatékonyságát.</p>
<p>Röviden, az Organifer Bentonite sokoldalú talajjavító, amely javítja a talaj vízkezelését, jobban megtartja a tápanyagokat, és aktiválja a talaj életét, ezáltal egészségesebb növényeket és termékeny talajt eredményez.</p>"
gid://shopify/Collection/657056596292,arnyekos-pazsit-vetomag,Árnyékos pázsit vetőmag,"<p>Shade Lawn Seed – Elegant ideális árnyékban lévő gyep létrehozásához vagy helyreállításához. A Shade Lawn Seed – Elegant azok számára készült, akik magas igényeket támasztanak a gyep díszértékével szemben. A használt vörös fűféle sűrű és vékony levelű gyepet képez. Ez a professzionális fűmagkeverék árnyékban is jól fejlődik. A fű száraz körülmények között is megfelelően növekszik, és jól állja a sarat, amikor rövidre nyírják. A díszgyep szép zöld színt és elegáns megjelenést mutat.</p>
<p>Tökéletes Gyep Még Árnyékban is<br>A Shade Lawn Seed – Elegant olyan fűtípusokat tartalmaz, amelyek kiválóan teljesítenek kevés napfény mellett is. Még árnyékban is gyönyörű gyep fejlődik. Megakadályozza a moha és a kopasz foltok képződését. Magas árnyéktűrő képessége mellett a fűmagkeverék magas szárazságtűréssel is rendelkezik. Röviden, nagyon sokoldalúan használható dísz- és árnyékgyepként egyaránt.</p>
<p>A professzionális gyepmegoldás tájépítészek számára, kifejezetten a kertészetek és parkok igényeihez igazítva. A vörös fűfélék és finom levelű rozs kombinált használata vizuális vonzerőt teremt. Magas sikerarány minden talajtípuson és könnyű karbantartás. A legmagasabb minőségű fűmag a piacon, kiváló csírázási képességgel. Gyorsan létrehozhat egy gyönyörű díszgyepet, amely ellenáll a gyakori gyalogosforgalomnak és tartós. Ráadásul a fű magas díszértékkel bír és könnyen karbantartható. Sok tájépítész kizárólag az Organifer fűmagokat használja, mert gyorsan csíráznak, gyorsan megerősödnek, magas regeneráló képességgel rendelkeznek és szép megjelenésűek.</p>
<p>A Legjobb Választás Az Árnyékgyep Között<br>Kifejezetten alkalmas díszgyephez és díszkertekhez. Ezt a keveréket a gyakorlatban gyakran díszgyepnek vagy árnyékgyepnek nevezik. Mivel a keverék főként lassan növő fűfélékből és olyan fűtípusokból áll, amelyek megőrzik sötét zöld színüket az év során, a gyep könnyen karbantartható. A Shade Lawn Seed – Elegant jól alkalmazkodik az árnyékos területekhez, zárt gyepet képez, amely rövidre nyírható.</p>"
gid://shopify/Collection/657056629060,sport-es-jatek-gyepmag,Sport és játék gyepmag,"<p>Sports and Play Lawn Seed - Resilient tartalmazza a tökéletes formulát a nagy igénybevételnek kitett gyep számára. Gyors csírázása biztosítja a robusztus gyepet, amely önmagát regenerálja. Eredetileg professzionális sportpályákhoz fejlesztették ki, ideális magkeverék sport- és játszókertekhez egyaránt. Előnyben részesítik kempingekben, fesztiválhelyszíneken, parkokban, és minden olyan helyen, ahol strapabíró, magas regeneráló képességű fűre van szükség.</p>
<p>Ez a magkeverék nemcsak magas kopásállóságot és gyors telepítést kínál, hanem kivételes regeneráló képességgel is rendelkezik. A vetés után a keverék gyorsan megtelepszik, kitöltve a kopár foltokat. Összetétele garantálja a sűrű gyepet, ahol a moha és a gyomok nehezen telepednek meg.</p>
<p>A professzionális tájépítészek és sportpálya-menedzserek kedvelik a Sports and Play Lawn Seed - Resilient-t. Gyors növekedése és telepítése, valamint vonzó esztétikája kiemeli a többi közül. A keverék jelentős mennyiségű finom rozs fűt tartalmaz, ami sima letelepedést biztosít. Ezenkívül a réti fű hozzáadása rendkívül ellenálló gyepet eredményez.</p>"
gid://shopify/Collection/657056661828,talajjavito-aktivator-keverek,Talajjavító aktivátor keverék,"<p>Ez a talajjavító, amely élő gombákat és baktériumokat (beleértve a Mycorrhiza bacillust) tartalmaz, serkenti és aktiválja a talaj ökoszisztémáját. Az ultimate talajjavító keveréke a worm castings (gilisztakompó) és a szárított tehéntrágya, ásványokkal és vulkáni kőporból származó nyomelemekkel dúsítva.</p>"
gid://shopify/Collection/657056694596,novenyi-taplalek-all-in-one,Növényi táplálék All-In-One,"<p>Az Organifer Növénytáp All-In-One egy univerzálisan alkalmazható teljes trágyázó minden szobanövényhez, cserepes növényhez, teraszon és erkélyen lévő növényekhez, de széles körben használják zöldségek, gyümölcsök, fűszernövények organikus termesztésében, valamint a gyep és díszkertek folyékony trágyázásában is. Ez az organikus univerzális trágya biztosítja az egészséges növekedést és az optimális teljesítményt.</p>"
gid://shopify/Collection/657056727364,scarifying-keverek,Scarifying keverék,"<p>Az Organifer Gyepfelújító a tökéletes keverék a gyenge, ritka fű átalakítására egy teljes, erős és zöld gyepé. A gyep javítására és regenerálására szolgáló professzionális keverék egy hónapon belül egészséges és sűrű zöld gyepet biztosít a gyep fésülése után. Az eredmények és a kényelem a magas minőségű fűmagvak, trágyák és talajjavítók kombinációjából származnak. Mindez optimális arányban van összekeverve egy masszív zsákban, így ez a keverék garantálja a sikert egy lépésben. Nem meglepő, hogy az Organifer Gyepfelújítót évek óta sikeresen használják kertészek és igényes fogyasztók. Megakadályozza a gyomokat, mohát és üres foltokat; az Organifer Gyepfelújítóval egy egészséges, sűrű, sötétzöld gyepet választ.</p>"
gid://shopify/Collection/657056792900,vas-szulfat-mutragya,Vas-szulfát műtrágya,"<p>Vashidroszulfát-trágya a sűrű, buja zöld gyepért, moha nélkül. Ezen kívül más kerti növények vasellátására is alkalmas. A magas vas tartalom hozzájárul a gyep jobb versenyképességéhez a nem kívánt mohával és gyomokkal szemben. A vashidroszulfát kulcsszerepet játszik a (fű) növények fotoszintézisében. A trágya biztosítja, hogy a növények hatékonyan hasznosítsák a napfényt, növelve ezzel a rezilienciájukat és megelőzve a levélbetegségek könnyű megjelenését.</p>"
gid://shopify/Collection/657056858436,viragmag-keverekek,Virágmag keverékek,"<p>A virágkeverékek ideális megoldást kínálnak, hogy kertjét vagy közterületét a szépség oázisává varázsolják. Gondosan válogatott virágmagjainkkal lélegzetelállító színkavalkádot és felejthetetlen illatot garantálunk. Virágkeverékeinket aprólékosan válogatjuk, és csak a legfinomabb, őshonos virágfajtákat tartalmazzák.</p>
<p>Ezek a virágkeverékek hozzájárulnak a biodiverzitás növeléséhez, és támogatják különböző rovar- és állatfajok fennmaradását. Emellett javítják a talaj minőségét, mivel szerves anyagot és tápanyagokat juttatnak a földbe. Az Organifer virágkeverékek könnyen karbantarthatók, csodálatos virágzást nyújtanak minimális erőfeszítéssel. Kizárólag környezetbarát és természetes termékeket biztosítunk, lehetővé téve, hogy aggodalom nélkül élvezhesse a természet szépségét.</p>"
gid://shopify/Collection/657056923972,tavi-labdak-novenyi-tapanyaggal,Tavi labdák növényi tápanyaggal,"<p>A tavi növények kulcsszerepet játszanak a tavában, nemcsak dekoratív elemekként, hanem a víz tisztán és világosan tartásában is. Ezért a tavi növények egészséges növekedése elengedhetetlen az algák fejlődésének megelőzésére és a vízi állatok védelmére.</p>
<p>A növényei egészségének megőrzésére az Organifer EM Tápanyaggolyók kínálják a tökéletes megoldást. Ezek a golyók nemcsak makro- és mikroelemeket tartalmaznak a megfelelő tápanyagokhoz, hanem biztosítják a kontrollált felszabadulást is, hogy elkerüljék a túladagolást vagy aluladagolást. Ezen kívül a tápanyaggolyók nemcsak a növények növekedését stimulálják, hanem azok ellenállását is a betegségekkel és kártevőkkel szemben.</p>
<p>Az EM Tápanyaggolyók könnyen használhatóak és mindenféle tavi növényhez alkalmasak. Egyszerűen elhelyezheti őket a növények kosarában, bedughatja őket a szűrő üledékébe, vagy szétoszthatja őket a tavi vízinövények között. Azonnal elsüllyednek, és lassan bocsátják ki a tápanyagokat, így növényei egészségesek és tápláltak maradnak egész évben.</p>"
gid://shopify/Collection/657056956740,diatomafold-por,Diatómaföld por,"<p>Széles körben elismert, hogy a természetes diatóma föld biztonságos és hatékony módszer különböző kártevők ellen. Ezek közé tartoznak a hangyák, ezüsthalak, darazsak, ágyipoloskák, tűzbogarak, bolhák, tetvek, atkák, csótányok, kerekesfarkúak, piros atkák, madáratkák, levéltetvek, lisztmoly lárvák, gombaflyák, tripszek és egyéb káros rovarok. Az Organifer Diatóma Föld sokoldalú, teljesen természetes, szagtalan, és mind beltéri, mind kültéri használatra alkalmas.</p>
<p>A diatóma föld mechanikai úton működik, ahol a mikroszkopikus részecskék átszúrják a rovarok védőviasz rétegét, dehidratálják őket, és végül megölik őket. Fontos megjegyezni, hogy a diatóma föld nem szelektív, és minden rovarra hat, amely érintkezésbe kerül vele, beleértve a hasznosakat is. Ezért elengedhetetlen, hogy a port gondosan és stratégiailag alkalmazzuk, hogy elkerüljük a nem szándékos károkat. Akkor marad hatékony, ha száraz és zavartalan. A diatóma föld ártalmatlan az emberekre és az állatokra, így gyakran választott alternatívája a vegyi növényvédő szereknek.</p>"
gid://shopify/Collection/657057022276,zoldseges-kerti-magok,Zöldséges kerti magok,"<p>A Zöldségmag Készletek gondosan válogatott alapvető és kulináris zöldségek, gyümölcsök és fűszernövények gyűjteményét kínálják, tökéletesen alkalmasak bármilyen konyhakerthez. Minden magfajta az egyszerű növeszthetőség és a különböző évszakokhoz való alkalmazkodás alapján lett kiválasztva, biztosítva a bőséges termést. A magok kényelmes csomagolásban vannak, ami megkönnyíti a tárolást és a rendszerezést, és a csomagokon részletes leírások találhatóak.</p>
<p>Hasznos tippeket találsz a talaj előkészítéséről, a betakarításról és a tárolásról, ami egyszerűvé teszi a kezdő és tapasztalt kertészek számára is, hogy sikeresek legyenek a konyhakertjükben.</p>
<p>Elsődleges szempont számunkra vásárlóink és a környezet egészsége és biztonsága, ezért a magjaink mentesek a vegyi kezelésektől, és kizárólag az Egyesült Királyságban bejegyzett, nem genetikailag módosított (Non-GMO) fajtákból állnak. Nyugodtan számíthatsz a kiváló minőségű, egészséges és biztonságos magokra.</p>"
