ID,Handle,Title,DescriptionHTML
gid://shopify/Collection/657057055044,rovarfrasz-mutragya,Rovarfrasz műtrágya,"<p>A Frassor Insect Frass egy szerves trágyázó minden növény számára – fű, zöldségeskert, díszkert és professzionális termesztés. A Frassor trágya pelletjei 100%-ban tiszta frasszból (rovarürülék) készülnek, amelyet a fekete katona légy lárváiból nyernek. Ez egy holland minőségű termék, amelyet szárítanak és higiénizálnak hőkezeléssel, majd egyedi pelleté formálnak.<br><h2>Alapvető tápanyagforrás</h2><br>Ezek a Frassor trágyapelletek 3-3-3-as NPK értékkel és magas kitin tartalommal rendelkeznek. Ezenkívül a termék gazdag ásványi anyagokban, nyomelemekben és szerves anyagokban. Ez az univerzális trágya tartalmazza az összes szükséges tápanyagot mind a fű, mind a növények számára. 100%-ban organikus lévén, a tápanyagok kontrollált módon szabadulnak fel, és nem mosódnak ki. A Frassor használata javítja a hozamokat és a növekedés, virágzás, valamint a növények és talaj ellenállóságának minőségét.<br><h2>Frass</h2><br>A frass a növényevők ürüléke. A Frassor rovar frassz ebben a termékben a fekete katona légy lárváiból származik. A rovarokat alacsony értékű, növényi alapú maradékáramokkal etetik, amelyeket magas minőségű fehérjékké és zsírokká alakítanak át. A Frassor gazdagítja és feldolgozza a frasszt, így magas minőségű természetes trágyázókat hoz létre.<br><h2>Tápanyag a talajélet számára</h2><br>Az egészséges talajélet rovarokkal kezdődik. Ezek a hatékony lények fenntartják az ökológiai egyensúlyt a természetben. Az általuk hátrahagyott maradványok, mint az ürülék és a bőrhámlások, gazdagok kitinben, amely nyersanyagként szolgál a Frassor számára. Ez a szerves trágya biztosítja, hogy a talaj víz- és tápanyagtartalma megmaradjon, ezáltal hosszabb ideig elérhetővé váljon a talajban. Az eredmény egy egészségesebb talaj, elegendő tápanyaggal, még szárazabb időszakokban is. A kitin táplálékforrást biztosít a jótékony talajorganizmusok számára, és támogatja a növények és a talaj ellenállóságát.<br><h2>Kitin – Serkenti az antagonista aktivitást, így növeli a növények és a talaj ellenállóságát</h2><br>A Frassor rendkívül gazdag kitinben. A kitin szuperélelmiszer a mikroorganizmusok számára, amelyek lebontják azt. E folyamat során enzimek szabadulnak fel (kitinázok), amelyek aktiválják a növény természetes védekezési mechanizmusait. Ennek eredményeként a növény kevésbé vonzó a betegségek és kártevők számára. Nem meglepő, hogy a Frassor sikeresen alkalmazható a kertészeti ágazatban.<br><h2>A legjobb a környezet számára</h2><br>A Frassor a legalacsonyabb CO2-lábnyommal rendelkezik az összes trágyázó között! A mesterséges trágya előállítása sok energiát igényel, ami jelentős CO2-kibocsátáshoz vezet. Ezenkívül a mesterséges trágyák negatív hatással vannak a talajban lévő életre, és gyorsan kioldódnak. A tehén-, csirke- és disznótrágyákhoz képest a Frassor rovar frasszának lényegesen alacsonyabb a CO2-lábnyoma. Emellett más környezeti szempontok, például a területfelhasználás és a vízfogyasztás tekintetében is felülmúlja a többit.</p>"
gid://shopify/Collection/657057087812,eszkozok,Eszközök,"<p>Professzionális nyomáspermetezők, ködpermetezők és szórók a műtrágyák, növényerősítők és talajjavítók gyors, hatékony és pontos kijuttatásához.</p>"
gid://shopify/Collection/657057186116,gilisztatragya-vermikomposzt,Gilisztatrágya Vermikomposzt,"<p>A vermikomposzt, más néven féregtrágya, egy erőteljes és természetes talajjavító, amely gazdagítja a talajt alapvető mikroorganizmusokkal, beleértve a baktériumokat és gombákat. Ezek a mikroorganizmusok segítik az organikus anyag lebontását és serkentik a növények növekedését. Ezenkívül a féregtrágya egyedi összetétele biztosítja a tápanyagok optimális felszívódását a növények által, ezáltal erősebbé és egészségesebbé teszi őket.</p>
<p>A féregtrágyával javított talajszerkezet lehetővé teszi, hogy a növények gyökerei mélyebbre és szélesebbre nőjenek, ami jobb víz- és tápanyagfelszívódást eredményez. A vermikomposzt gazdag enzimekben is, körülbelül 2 milliárd enzim található grammonként, ami tovább javítja a tápanyagfelvételt. Emellett elősegíti a növények természetes ellenállását a betegségekkel és gombákkal szemben.</p>
<p>A féregtrágya használata gyorsabb csírázást, simább átültetést és gyorsabb betakarítást biztosít. Röviden, a féregtrágya elengedhetetlen talajjavító mindazok számára, akik egészséges, élénk és fenntartható kertre törekszenek.</p>"
gid://shopify/Collection/657057251652,pazsit-topdressing-mix,Pázsit Topdressing Mix,"<p>Ez a Gyepfelület-javító Keverék élő gombákkal és baktériumokkal (beleértve a mycorrhiza gombákat és a Bacillus fajokat) serkenti és aktiválja a talajéletet. Az ultimate felület-javító keverék féregtrágyából és szárított tehéntrágyából áll, ásványi anyagokkal és nyomelemekkel gazdagítva, amelyek vulkáni őrleményből származnak.</p>
<p>A termékeny talaj él!<br>Az Organifer táplálja a talajt és serkenti a pozitív talajéletet. Ez a Gyepfelület-javító Keverék helyreállítja a talajt és megelőzi a problémákat. A talajélet segíti a tápanyagok pufferelését, így azok elérhetővé válnak, amikor a fűnek szüksége van rájuk. Az aktív talajélet aktiválásával és bevezetésével nemcsak a füvet tápláljuk, hanem a talajt is.</p>
<p>A fű szimbiózisban él a gombákkal és baktériumokkal.<br>Ezzel a Gyepfelület-javító Keverékkel élő Mychorizza gombákat és Rhizobacteria-t is bevezetünk és aktiválunk. A pozitív talajélet, mint a férgek és gombák, alagutakat képez a talajban, lehetővé téve a levegő, szerves anyagok és más tápanyagok eloszlását a talajban. A holt növényi anyagot komposztálókká alakítják tápláló nyersanyaggá. Ezt a Gyepfelület-javító Keveréket sikeresen alkalmazzák a gyakorlatban az egészséges talajélet serkentésére. Különösen a növénygyökerek körüli területen, az úgynevezett rizoszféra területén, millió gomba és baktérium él, amelyek kölcsönösen tápanyagokat cserélnek egymással és a növényekkel, javítva ezzel egymás életét.</p>
<p>A pozitív mikrolife a növényt szolgálja, amely cserébe cukrokat kínál. Az egészséges talajélet több ezer különböző baktériumot, gombát és enzimet tartalmaz, amelyek bizonyos módon együttműködnek a kölcsönös előny érdekében. Bizonyos baktériumok semlegesítik a veszélyes anyagokat, például a nehézfémeket. A hozzáadott Azotobacter baktérium a levegőből nitrogént von ki, és ezt cukrokért cseréli a növénnyel. Más mikroorganizmusok lebontják a holt növényi anyagot és tápanyagokká alakítják. Néhányan a kórokozókat támadják meg, míg a fontos gombák segítenek a tápanyagok mélyebb kivonásában a talajból. A hozzáadott Bacillus baktériumok elősegítik a gyökérnövekedést és növelik a kórokozókkal szembeni ellenállást. Röviden, a talaj él! Az egészséges ökoszisztéma kulcsfontosságú. A Gyepfelület-javító Keverék egyensúlyba hozza a talajt, támogatja a pozitív talajéletet, és növeli a növények és a talaj ellenállását. Egészséges talajban egészséges növények nőnek, így nincs helye a betegségeknek és kártevőknek.</p>
<p>A vulkáni őrlemény gazdag alapvető ásványi anyagokban és nyomelemekben.<br>Sok talaj hiányos ásványi anyagokban és nyomelemekben, ami miatt a talajban és a növényekben zajló folyamatok nem optimálisan működnek. Ez a Gyepfelület-javító Keverék magas minőségű Organifer vulkáni őrleménnyel van gazdagítva, amely pótolja az alapvető ásványi anyagokat és nyomelemeket. Ez természetesen termékenyebbé teszi a talajt.</p>
<p>Féregtrágyák<br>Az Organifer féregtrágyákat a legjobbnak tartják. Ez egy természetes talajjavító anyag, amely komposztált növényi maradékokból készült, optimális egyensúlyt biztosítva a talajban, így a növények növekedni és virágozni tudnak. A féregtrágyák mindent tartalmaznak, amire a növényeknek szükségük van: nagyon magas szerves tartalom (humusz) és számos nyomelem, enzim, ásványi anyag, baktérium és gomba. A humuszban gazdag talaj jobban megtartja a tápanyagokat. A féregtrágyákkal kombinálva a baktériumok és gombák virágozhatnak, és a talajszerkezet jelentősen javul.</p>
<p>Tápanyag az egészséges és életerős fűhöz.<br>A szárított tehéntrágya hozzáadásával nemcsak a talaj javul, hanem azonnal rendelkezésre álló tápanyag is biztosítva van. Ez a szerves trágya tartós hatással bír. A trágya táplálja a talajt, és gazdag, egészséges talajt biztosít. Ez elősegíti a kiegyensúlyozott növekedést és jó szerkezetet ad a fűnek. A szerves trágya energiahordozó a baktériumok számára, és humusszá alakul. A humusz jó talajszerkezetet biztosít és elősegíti a természetes folyamatokat. A Gyepfelület-javító Keverék aktív talajéletet és optimális talajszerkezetet biztosít, amely egészséges és életerős gyepet eredményez.</p>"
gid://shopify/Collection/657057284420,mikro-lohere,Mikro lóhere,"<p><div class=""flex max-w-full flex-col flex-grow""><br><div class=""min-h-[20px] text-message flex w-full flex-col items-end gap-2 whitespace-normal break-words [.text-message+&amp;]:mt-5"" dir=""auto"" data-message-author-role=""assistant"" data-message-id=""ef91941e-e0fe-4a6a-8e3c-3376d2639204""><br><div class=""flex w-full flex-col gap-1 empty:hidden first:pt-[3px]""><br><div class=""markdown prose w-full break-words dark:prose-invert dark""></p>
<p>A piacon elérhető legjobb lóherékként tanúsított Organifer Microclover egy tartós, kislevelű fehér lóherefajta, amely könnyen beilleszthető a fűmagkeverékekbe, így esztétikailag értékes, folyamatosan zöldellő gyepet biztosít. Ez a figyelemre méltó növény természetes módon gazdagítja a talajt azáltal, hogy megkötni a nitrogént a levegőből, csökkenti a műtrágya szükségletet, és egész évben dús, zöld gyepet biztosít, még száraz időszakokban is.</p>
<p></div><br></div><br></div><br></div></p>"
gid://shopify/Collection/657057317188,yucca-nedvesitoszer,Yucca nedvesítőszer,"<p>A Yucca Nedvesítő Ügynök optimalizálja a talaj nedvességtartalmát és javítja a növények növekedési feltételeit, még száraz és kihívásokkal teli környezetben is. A Yucca schidigera (spanyol tőr) természetes nedvesítő anyagokat tartalmaz, amelyek segítik a növények nedvességmegtartását és védelmet nyújtanak a stressz ellen a magas szteroid szaponin tartalmuk (min. 10%) miatt. Ez ideálissá teszi azokat a területeket, ahol korlátozott a víz elérhetőség, javítva a talaj nedvességtartását és elősegítve az egészségesebb, termékenyebb növényeket. A Yucca Nedvesítő Ügynök fokozza a jótékony talajbaktériumok növekedését, amelyek lebontják az organikus anyagokat és tápanyagokat bocsátanak a növények számára. Növeli a növényvédő szerek és műtrágyák hatékonyságát a jobb felszívódás révén, ezáltal csökkentve ezen termékek szükségességét. A szaponinok csökkentik a víz felületi feszültségét, biztosítva a jobb nedvességszabályozást, gyökerezést és levélborítottságot, ami erősebb gyökerekhez és egészségesebb növényekhez vezet. A Yucca Nedvesítő Ügynök alkalmas golfpályákra, sportpályákra, gyepre, virágágyásokra, díszkertekre, mezőgazdaságra és zöldségkertekre. A termék teljesen természetes, biztonságos a növények, állatok és emberek számára, és egész évben használható. Válassza az Organifer Yucca Nedvesítő Ügynökét az optimális eredmények érdekében, még szárazabb időszakokban is.</p>"
gid://shopify/Collection/657057349956,pro-gyep-es-gyeptragya,Pro Gyep- és Gyeptrágya,"<p>A Pro Gyep- és Gyeptrágya kifejezetten nagy, igényes gyepfelületek, sportpályák és golfpályák számára készült. Ez a 20+5+8 (+4+9) mineralizált trágya tartós és hatékony tápanyagellátást biztosít a nitrogén fokozatos felszabadulásán keresztül. Ez megakadályozza a hirtelen növekedési rohammal járó problémákat, csökkenti a vízveszteséget és a gyep rétegesedését. Tartalmaz ammónium-nitrogént, magnéziumot és vasat, amelyek elősegítik az erős zöld színt és megakadályozzák a moha kialakulását. A termék pormentes, finom granulátum (1-3 mm), amely minimális csapadék mellett oldódik, és kézzel vagy mechanikus szóróval alkalmazható.</p>"
gid://shopify/Collection/657057382724,takaronoveny,Takarónövény,"<p>Sokoldalú zöldtrágyakeverékeink célja a talajélet támogatása és a hasznos mikroorganizmusok számának növelése. A növénycsaládok széles választékával ezek a keverékek segítenek elnyomni a gyomnövények növekedését, csökkenteni a talaj eredetű betegségeket, és elősegíteni az egészséges talajszerkezetet. Ideális takarónövényekként javítják a szerves anyag tartalmát, optimalizálják a víz beszivárgását, és védelmet nyújtanak a talajerózió ellen. A biodiverzitás elősegítésével hozzájárulnak a változatos ökoszisztémához és növelik a talaj termékenységét, ami magasabb és ellenállóbb hozamokat eredményez. Minden talajtípushoz alkalmazható.</p>"
gid://shopify/Collection/657057415492,viraghagymak,Virághagymák,"<p>A virághagymákat Hollandiában termesztik és gondosan válogatják a legmagasabb minőség érdekében. Ezek a hagymák, amelyeket olyan neves kertekben is használnak, mint a 'de Keukenhof', a legnagyobb és legpotensebb elérhető hagymák közé tartoznak. A vibráló színváltozatokban kapható tulipánhagymák, elegáns nárciszok, figyelemfelkeltő Muscari Armeniacum és a különleges Allium Purple Sensation hagymák gazdag és hosszan tartó virágzást biztosítanak a kertben. A krókuszhagymák korai és színes tavaszi virágzást is nyújtanak. Ezen minőségi hagymák segítségével a kert minden évszakban színes és virágzó paradicsommá alakul.</p>"
gid://shopify/Collection/657057481028,takarmany,Takarmány,"<p>Gondoskodjon a kertjében élő madarakról, mókusokról és sünökről speciálisan kiválasztott takarmányainkkal. Madárkeverékünk extra tápanyagokat biztosít, és a nem-csírázó formula révén megakadályozza a nem kívánt magok növekedését a kertjében. A mókusok számára tápláló, energiában gazdag takarmányt kínálunk, míg a sünöknek kifejezetten az igényeikhez igazított kiegyensúlyozott formulát.</p>
<p>Minden termékünk 100%-ban környezetbarát, és mentes a káros adalékanyagoktól. Így egyszerűen és felelősségteljesen támogathatja a kertjében élő állatokat, biztosítva a kert élettel teliségét és egyensúlyát.</p>"
gid://shopify/Collection/657057612100,vetoburgonya-hagyma-es-salottahagyma-keszletek,"Vetőburgonya, Hagyma- és Salottahagyma Készletek","<p>Üdvözöljük professzionális vetőburgonyák és ültetési anyagok kínálatában! A megfelelő kiindulási anyag elengedhetetlen a jó termesztéshez és az optimális hozam eléréséhez. Vetőburgonyáink és ültetési hagymáink kifejezetten professzionális termesztéshez lettek kifejlesztve, és megfelelnek a legmagasabb minőségi követelményeknek. Ezeket kisebb csomagokban is kínáljuk, így a legjobb kiindulási anyag a kisebb termesztők számára is elérhető.</p>
<p>&nbsp;</p>
<p>Minden vetőburgonyánk, beleértve a népszerű fajtákat, mint a Bintje, Frieslander és Annabelle, valamint ültetési anyagaink, NAK-minősítéssel rendelkeznek Hollandiában. Ez garantálja, hogy a terméshozamok legmagasabb minőségére támaszkodhat. Fedezze fel különböző fajtáinkat, amelyek különféle éghajlati viszonyokhoz és talajtípusokhoz alkalmazkodnak.</p>
<p>&nbsp;</p>
<p>Az organikus kertészek számára széles választékot kínálunk organikus vetőburgonyákból, amelyek mind SKAL-minősítéssel rendelkeznek. Ez a kínálat mindent magában foglal az organikus vetőburgonyától az organikus ültetési salottahagymákig, tökéletes a fenntartható termesztéshez.</p>"
gid://shopify/Collection/657057644868,vetomag,Vetőmag,"<p>Az Organifer vetőmagkeverékek NAK tanúsítással rendelkező fajtákból állnak (Holland Általános Ellenőrző Szolgálat Mezőgazdasági Vetőmagok és Vetőburgonyák Számára). Ez biztosítékot ad a keverék összetételére és minőségére. Ez a minőségi jelölés a holland tenyésztők kezdeményezése. Az optimális csírázási eredmény elérése érdekében az Organifer magas követelményeket támaszt a csírázóképességre és különösen a tisztaság minőségére. Garantáljuk a legjobb kiindulási anyagot a tökéletes eredményhez.</p>
<p>Íme néhány termékünk:<br>- Regeneráló fűmagok<br>- Játékfű magok<br>- Díszfű magok<br>- Árnyékfű magok<br>- Legelőfű magok<br>- Virágvető magkeverékek<br>- Zöldségmagok</p>
<p>Az Organifer minden vetőmagzsákja gondosan ki van választva a minősége és megbízhatósága érdekében. Akár a gyep szépítésére, akár zöldségkert indítására vágyik, a vetőmagjaink széles választéka minden kertész számára számos lehetőséget kínál. Ráadásul mivel NAK által tanúsítottak, bízhat a tisztaságban és a csírázási arányban minden mag esetében. Kezdje el kertészkedési útját Organifer vetőmagokkal, és figyelje, ahogy növényei virágoznak és betakarításai gazdagodnak.</p>"
gid://shopify/Collection/657058136388,gyepmutragya,Gyepműtrágya,"<p>A professzionális gyeptrágyák a mélyzöld, egészséges gyep létrehozására és fenntartására készültek, mentesen a mohától és gyomoktól.</p>
<p>A Gyeptrágya All-In-One egy magas minőségű organikus-minerális trágya, amely bármilyen típusú fű és talaj trágyázására alkalmas. Az extra magnézium jelenléte miatt minden gyep élénk zöld színűvé válik. Új telepítésekhez és karbantartási trágyázáshoz egyaránt megfelelő. Az azonnali és lassú lebontású összetevők egyedülálló kombinációja gyors növekedést biztosít, valamint 100 napos teljes tápanyagellátást nyújt. A Gyeptrágya All-In-One pozitívan serkenti a talajéletet és növeli a természetes talajtermékenységet minden egyes alkalmazás során. Az eredmény egy egészséges, sűrű gyep, ahol nincs hely a mohának és gyomoknak.</p>
<p>A vashidroszulfát-trágya valódi mohamentesítő, amely sűrű, buja zöld gyepet biztosít moha nélkül. A vashidroszulfát kulcsszerepet játszik a (fű) növények fotoszintézisében. A trágya biztosítja, hogy a növények hatékonyan hasznosítsák a napfényt, növelve ezzel a rezilienciájukat és megelőzve a levélbetegségek könnyű megjelenését.</p>
<p>A Gyepfelújító tökéletes keverék a gyenge, ritka fű átformálására egy teljes, erős és zöld gyepé. A professzionális keverék a gyep javításához és regenerálásához egészséges és sűrű zöld gyepet biztosít egy hónapon belül a gyep fésülése után. Az eredmények és a kényelem a magas minőségű fűmagvak, trágyák és talajjavítók kombinációjából származik. Mindez optimális arányban van összekeverve egy masszív zsákban, így ez a keverék garantálja a sikert egy lépésben. Nem meglepő, hogy az Organifer Gyepfelújítót évek óta sikeresen használják kertészek és igényes fogyasztók. Megakadályozza a gyomokat, mohát és üres foltokat; az Organifer Gyepfelújítóval egy egészséges, sűrű, sötétzöld gyepet választ.</p>
<p>Az Őszi Trágya All-In-One nagyon gazdag káliumban, és extra védelmet nyújt a hideg tél ellen a gyep, fű és növények számára. A trágya növeli a fagynak való közvetlen ellenállást. Az őszi trágya hatékonysága gyakran alulértékelt. Azáltal, hogy a fű erősen és megkeményedve lép be a télbe, megelőzhetőek a tavaszi problémák.</p>"
gid://shopify/Collection/657058169156,szarvforgacs-mutragya,Szarvforgács műtrágya,"<p>A szarutartalmú műtrágyák, mint például a szarulapát és a szaruliszt, 100%-ban természetes nitrogénforrások – ideális választás azoknak, akik tudatosan az organikus és fenntartható kerttrágyázás mellett döntenek. Ezek az organikus műtrágyák őrölt szaruból készülnek, amely állati melléktermék, és kb. 14% nitrogént (N) tartalmaz, teljes egészében szerves kötésben és lassú feltáródással. Ennek eredményeként a tápanyagok fokozatosan, 6–12 hét alatt szabadulnak fel, így egyenletes növénynövekedést biztosítanak perzselés vagy kimosódás veszélye nélkül.</p>
<p>A szarutartalmú műtrágya különösen alkalmas a nitrogénkedvelő növényekhez, mint például a káposztafélék, póréhagyma, burgonya, zeller, gyümölcsfák és bogyós gyümölcsök, de kiválóan alkalmazható dísznövényeknél, gyepeknél, virágágyásokban és komposztálás során is. A szarulapát durvább vagy finomabb szemcsemérete serkenti a talajéletet, elősegíti a humuszképződést, és hozzájárul a laza, egészséges talajszerkezet kialakulásához. Lassú tápanyag-feltáródásának köszönhetően ideális alaptrágyaként szolgál organikus és regeneratív termesztési rendszerekben.</p>
<p>A termék szagmentes, biztonságosan használható, valamint teljesen mentes mesterséges műtrágyáktól, szintetikus adalékanyagoktól és komposztmaradványoktól, így kiváló választás profi termesztők és igényes hobbikertészek számára egyaránt. Válassza a szarutartalmú műtrágyát mint fenntartható megoldást a hosszú távú nitrogénellátásra és az aktív talajjavításra.</p>"
gid://shopify/Collection/657058201924,sovenyek-tiszafak-es-tuleveluek,"Sövények, Tiszafák és Tűlevelűek","<p>Az All-in-One műtrágya sövényekhez, tiszafákhoz és tűlevelűekhez kifejezetten arra lett kifejlesztve, hogy örökzöld növényei egészségesek, dúsak és életerősek maradjanak. Kiegyensúlyozott NPK 5+4+6 összetétele, magnéziummal (+4) dúsítva, serkenti az erőteljes hajtásképződést, a mély gyökérnövekedést és az intenzív zöld lomb- és tűszín kialakulását.</p>
<p>A műtrágya gyors és hosszan tartó hatást is biztosít az azonnal felvehető és fokozatosan feltáródó tápanyagok kombinációjának köszönhetően. Emellett a magas szervesanyag-tartalom javítja a talajéletet és fokozza a talajszerkezetet. Ideális új telepítésekhez és meglévő növényállomány fenntartásához egyaránt. Az egészséges, kompakt és ellenálló sövényekért és tűlevelűekért, szezonról szezonra.</p>"
gid://shopify/Collection/657058234692,gyapjubol-keszult-mutragya,Gyapjúból készült műtrágya,"<p>A juhgyapjú pellet egy 100%-ban természetes műtrágya, amely frissen nyírt, tiszta juhgyapjúból készül. Kiemelkedően magas nitrogéntartalommal (10,5%) és természetes, 8–10 hónapon át tartó lassú feltáródással rendelkezik, így ideális tápanyag-utánpótlás intenzíven fejlődő növények számára, mint például káposztafélék, saláta, póréhagyma, paradicsom, burgonya, gyümölcsfák és virágzó dísznövények.</p>
<p>A pellet szerves kötésű nitrogénnel, káliummal, kénnel és magnéziummal gazdagítja a talajt, aktívan hozzájárul a humuszképződéshez, a talaj levegőztetéséhez és az egészséges talajélethez. Egyedi, rostos szerkezetének köszönhetően saját tömegének akár háromszorosát is képes víz formájában megkötni, így biztosítja a stabil nedvességmegőrzést és a szárazság elleni védelmet.</p>
<p>Teljesen mentes a vegyi műtrágyáktól, komposztmaradványoktól, növényvédő szerektől és szintetikus adalékanyagoktól. Alkalmas biogazdálkodásra (EU Bio-kompatibilis és FiBL-regisztrált). Tökéletes választás zöldségkertekbe, díszkertekbe, gyümölcsösökbe, professzionális termesztéshez és cserepes növényekhez.</p>"
gid://shopify/Collection/657058267460,rozsak-es-viragok,Rózsák és virágok,"<p>Az All-in-One műtrágya rózsákhoz és virágzó növényekhez kifejezetten úgy lett összeállítva, hogy elősegítse az erőteljes növekedést és a bőséges virágzást. Kiegyensúlyozott NPK 9+4+8 összetétele, magnéziummal (+2) dúsítva, a növekedés minden szakaszát támogatja – az erős hajtásoktól a színpompás virágokig.</p>
<p>A gyorsan ható és lassan feltáródó tápanyagok kombinációjának köszönhetően a növények folyamatosan hozzájutnak az esszenciális elemekhez. A hozzáadott szerves anyag javítja a talajszerkezetet, és fokozza a víz- és tápanyagfelvételt. Ideális szegélyekbe, virágágyásokba, díszkertekbe és cserepes növényekhez – az erőteljes növényekért, több virágért és igazán látványos eredményért.</p>"
