ID,Handle,Title,DescriptionHTML
gid://shopify/Collection/657054171460,tehentragya-pellet,Tehéntrágya pellet,"<p>A 3 az 1-ben tehéntrágya pelleták rendkívül alkalmasak ültetési trágyaként díszkertekhez, virágágyásokhoz, gyephez, hagymás és gumós növényekhez, zöldségkertekhez, rózsákhoz, cserepes növényekhez és gyümölcsfákhoz. Ezek a pelleták javítják a talajszerkezetet és a vízmegtartó képességet, elősegítik a termékeny talajkörnyezetet, és természetes módon gazdagítják a talajt a hosszú távú egyensúly fenntartása érdekében. Ezek egy univerzális trágya, amely minden talajtípushoz megfelelő, és tökéletesen alkalmazható ültetési és alaptrágyaként gyephez, virágágyásokhoz, zöldségkertekhez, legelőkhez és gyümölcsösökhöz. Ezen kívül a pelleták talajaktiválóként is használhatók a pozitív talajtevékenység gyors serkentésével.</p>"
gid://shopify/Collection/657054204228,oszi-mutragya,Őszi műtrágya,"<p>Ez a professzionális őszi trágya nagyon gazdag káliumban, és extra védelmet nyújt a hideg tél ellen a gyep, fű és növények számára. A trágya növeli a fagynak való közvetlen ellenállást. Ezenkívül ásványi anyagok és nyomelemek is kerültek a trágya granulátumokba. Az Őszi Trágya All-In-One granulátumai biztosítják, hogy a gyep és a növények sötétzöldek, erősek és télállóak legyenek. Ez a magas minőségű táplálék közvetett hatással van a mohára és gyomokra. A szagtalan trágya granulátumok könnyen felszívódó nitrogénnel és káliummal (NPK 6-2-12) vannak gazdagítva. A tartós hatás (+100 nap) miatt elegendő tápanyag marad a fű jó regenerálódásához és egy erős, sűrű gyep kialakulásához, ahol a mohának és gyomoknak nincs esélyük, még a gyep fésülése után sem. Ennek eredményeként egy egészséges, erős gyep alakul ki, amely jobban ellenáll a kopásnak, aszálynak és fagyoknak. Az őszi trágya hatékonyságát gyakran alulértékelik. Azáltal, hogy a fű erősen és megkeményedve lép be a télbe, megelőzhetőek a tavaszi problémák.</p>"
gid://shopify/Collection/657054236996,legelo-mutragya,Legelő műtrágya,"<p>Az All-In-One Legelőtrágya a legjobb választás a lovak legelőjének optimális trágyázására. Kiválóan alkalmas a fűnyíró legelők és hobbi állatok legelőjének trágyázására is. Ez egy komplett, univerzális legelőtrágya higiénizált trágyán alapul, természetes ásványi anyagokkal és nyomelemekkel gazdagítva az egyenletes növekedés és az erős gyep érdekében. Az eredmény egy magas minőségű és ízletes fű/rostos anyag, valamint egy természetesen termékeny talaj.</p>"
gid://shopify/Collection/657054302532,vegan-novenyi-alapu-mutragya,Vegán növényi alapú műtrágya,"<p>A Vegán Növénytáp 100%-ban növényi alapú organikus trágya, amely teljesen mentes az állati nyersanyagoktól, például trágyától. Ez a professzionális trágya minden talajtípushoz alkalmas, és kiválóan használható ültetési és alaptrágyaként gyephez, virágágyásokhoz, zöldségkertekhez, gyümölcsösökhöz és szobanövényekhez. A Vegán Növénytáp nagyon jó talajaktiváló, amely serkenti a talajéletet. Magas szerves anyag tartalma miatt javítja a talajszerkezetet és a vízmegtartó képességet. Ezenkívül a vegán növénytáp elősegíti a termékeny talajéletet és biztosítja a természetes talajgazdagítást, hogy a talaj folyamatosan kiegyensúlyozott maradjon. A Vegán Növénytáp kedvező NPK aránnyal (6-3-2) rendelkezik, és különösen gazdag összetételű. A tápanyagokat a növények kiválóan felszívják, és adagolt módon bocsátják rendelkezésre. Ez a növényi trágya univerzálisan alkalmazható, kellemes illatú, és biztonságos emberek és állatok számára.</p>"
gid://shopify/Collection/657054335300,gyepmutragya-all-in-one,Gyepműtrágya All-In-One,"<p>A Gyeptrágya All-In-One a mélyzöld gyep létrehozására és fenntartására készült, mentesen a mohától és gyomoktól.</p>
<p>Ez egy magas minőségű organikus-minerális trágya, amely bármilyen típusú fű és talaj trágyázására alkalmas. Az extra magnézium jelenléte miatt minden gyep intenzíven zölddé válik. Új telepítésekhez és karbantartási trágyázáshoz egyaránt megfelelő. Az azonnali és lassú lebontású összetevők egyedülálló kombinációja gyors növekedést biztosít, valamint 100 napos teljes tápanyagellátást nyújt. A Gyeptrágya All-In-One pozitívan serkenti a talajéletet és növeli a természetes talajtermékenységet minden egyes alkalmazás során. Az eredmény egy egészséges, sűrű gyep, ahol nincs hely a mohának és gyomoknak.</p>
<p>A Gyeptrágya All-In-One magas káliumtartalmának köszönhetően erős gyepet biztosít, amely jobban ellenáll a kopásnak, aszálynak és fagyoknak. A trágya tavaszi és őszi alkalmazásra is kiváló, lehetővé téve a folyamatos gyeptrágyázást ugyanazzal a termékkel egész évben. A magas minőségű mikrogranulátum keverék fokozatos növekedést biztosít, serkenti az egészséges, erős gyepet, és javítja a talajt. A lassú lebontású granulátum gyors kezdeti hatást fejt ki, miközben tartós hatásokat biztosít.</p>
<p>A tápanyagok egyedi keveréke fokozatosan szabadul fel a talajélet által. A humusz, ásványi anyagok és nyomelemek képződése elősegíti a jobb gyökérfejlődést és megakadályozza a kimosódást. Ez a professzionális trágya ideálisan alkalmas gyepfelületekhez, sportpályákhoz és golfpályákhoz, ahol erős, sűrű gyepet kívánnak.</p>"
gid://shopify/Collection/657054368068,kerti-mutragya,Kerti műtrágya,"<p>A Kerttrágya All-In-One az optimális teljesítmény érdekében készült virágzó növények, cserjék, fák, rózsák, évelők, hagymások, gyümölcsfák, eper, gyümölcsök és gyökérzöldségek számára. Élvezze a finomabb gyümölcsöket, a gyönyörű növényeket, a mélyebb színeket és a több virágot. Javítja a talajszerkezetet és aktiválja a pozitív talajéletet. A magas káliumtartalom erős, ellenálló növényt biztosít. Ezen kívül ez a trágya extra gazdag magnéziumban, amely elősegíti az optimális fotoszintézist és a mélyebb színeket. A Kerttrágya All-In-One nem befolyásolja a talaj savasságát, így biztonságosan használható, és alkalmas savanyú talajt kedvelő növények számára. Ez a professzionális trágya univerzálisan alkalmazható minden zöldség- és díszkertben.</p>"
gid://shopify/Collection/657054499140,mesz-szemcses-mutragya,Mész szemcsés műtrágya,"<p>Ez az Organifer egyedülálló mésztrágya minden évszakra dúsított magnéziummal. Ideális a talaj savasodásának megakadályozására. Közvetve a mohát is visszaszorítja. A mész alkalmazása létfontosságú a pH-szint (savassági szint) korrigálásához a gyepben vagy a zöldségkertben. Minden növény számára rendkívül fontos, hogy a talaj megfelelő pH-értékkel rendelkezzen. A tápanyagok felvételével, amelyeket általában a kertbe és a gyepbe juttatnak, a talaj savassá válik. Az ""savkedvelő"" növényeken kívül ez semmiképpen sem ideális a termesztett növények és fűfélék egészséges növekedéséhez. A hozzáadott magnézium mély zöld színt biztosít, és hozzájárul az optimális fotoszintézishez és a talaj termékenységéhez.</p>"
gid://shopify/Collection/657054728516,lavako-por,Lávakő por,"<p>Az Organifer Primordial Rock Lavameal a legfinomabb minőségű ősi kőliszt a piacon. Ez egy egyedülálló lavameal, amely a legmagasabb koncentrációjú, felszívódó ásványi anyagokat és a legjobb feldolgozási képességeket kínálja. Széleskörűen felhasználható, tökéletes terítésre, szétszórásra vagy keverésre. Kertben széles körben használják talajjavítóként, és kiválóan védi a növényeket, például a tuját a kártevőktől. Ezenkívül ez a gazdag lavameal közvetetten harcol a zsurlóval és más gyomokkal is.</p>"
gid://shopify/Collection/657054826820,cserepes-novenyek-es-hidroponikus-termesztes,Cserepes Növények és Hidroponikus Termesztés,"<p>Az Organifer hidrogranulátumok egyaránt alkalmasak hidroponikus termesztésre és vízelvezető rétegként a virágcserepek és növénytartók alján. A hidrogranulátumok biztosítják a növények egészséges növekedését, valamint megfelelő támaszt nyújtanak a gyökerek számára. Ezért mindig egy réteg hidrogranulátumot helyezzen el a cserép alján, mielőtt feltölti azt ültetőközeggel.</p>
<p>A cserép méretétől függően 3–6 cm vastag réteg ajánlott az alján, amely javítja a cserép vízgazdálkodását, elősegítve a növények egészséges fejlődését. Kültéri cserepek esetében különösen fontos, hogy a cserép alján legyen vízelvezető nyílás, amely lehetővé teszi a felesleges víz elvezetését, megelőzve a gyökerek túlzott nedvesség okozta károsodását.</p>"
gid://shopify/Collection/657054892356,folyekony-tragya-a-novekedesi-fazisra,Folyékony Trágya a Növekedési Fázisra,"<p>Folyékony Trágya a Növekedési Fázisra - Amino Power egy teljes trágyázó, amely kifejezetten minden növény és termény növekedési fázisára (1. fázis) lett kifejlesztve. Ez a hatékony koncentrátum egyedülálló keveréket tartalmaz, amely alapvető aminosavakból és 9%-os organikus nitrogénből áll, amely enzimes hidrolízisen átesett fehérjékből származik. Az Organifer Amino Power 18 proteinogén aminosavat is tartalmaz.</p>
<p>A Folyékony Trágya a Növekedési Fázisra - Amino Power csökkenti az abiotikus stresszt, és biztosítja az optimális teljesítményt, egészséget és energiatakarékos növekedést.</p>
<p>A termék tengeri algákra alapozva készült, így gyorsan és könnyen felszívódik, elősegítve az egészséges, egyenletes növekedést és a jobb gyökérfejlődést. Az első lökést adja az egészséges, élénk növényhez és a teljes virágzáshoz.</p>
<p>A Folyékony Trágya a Növekedési Fázisra - Amino Power nagy sikerrel alkalmazható hidroponikus és szubsztrátos termesztésben, beltéri és kültéri termesztésben, mezőgazdaságban, valamint dísz- és haszonnövénykertekben. Ezen kívül a termék szobanövényekhez is alkalmas. A Folyékony Trágya a Növekedési Fázisra - Amino Power szerves kertészetben is használható, és univerzálisan alkalmazható minden növényre és terményre. A Folyékony Trágya a Növekedési Fázisra - Amino Power ideális a talajban vagy kókuszban történő szerves termesztéshez. Ezen kívül a termék korrigálja a növények nitrogén problémáit. A nitrogénhiány sárguló levelekkel ismerhető fel.</p>"
gid://shopify/Collection/657054925124,gyokerstimulator,Gyökérstimulátor,"<p>Gyökérstimulátor - Roots-Power-Concentrate egy erősen koncentrált organikus gyökérstimulátor. Ez a stimulátor biztosítja a gyors és élénk gyökérfejlődést, valamint a gyors regenerálódást átültetés után minden növény esetében. Ezenkívül javítja a tápanyagfelvételt és a talaj szerkezetét. Ideálisan alkalmas a növekedési fázisra és a virágzási fázis első heteire. Gondoskodik arról, hogy a növény a virágzási fázis kezdetén már elegendő gyökérzettel rendelkezzen, így minden energiáját a virágzásra fordíthatja. Ezért a Root Stimulator - Roots-Power-Concentrate alkalmazását a virágzás harmadik hete után abba kell hagyni. A Roots-Power-Concentrate serkenti a gyökérnövekedést és növeli a növény ellenálló képességét. Gyorsan és hatékonyan hat, és a növény szinte azonnal felszívja.</p>
<p>A Root Stimulator - Roots-Power-Concentrate elősegíti az erős növények fejlődését. A termék ideális a dugványokhoz és az átültetés alatt álló növényekhez. Amint a növény első gyökerei láthatóvá válnak, a Roots-Power-Concentrate alkalmazható. A termék jobb és gyorsabb gyökérfejlődést eredményez. A Roots-Power-Concentrate gyökérfogyasztó rovarokkal fertőzött növények esetében is alkalmazható a gyökerek gyors regenerálásához.</p>
<p>Ennek az erőteljes organikus koncentrátumnak a hatása lenyűgöző. Ez az élénkítő folyadék gyorsabb és jobb gyökérfejlődést, fokozott oxigénfelvételt és felgyorsított iontranszportot biztosít a kezdetektől fogva.</p>"
gid://shopify/Collection/657054957892,folyekony-mutragya-a-viragzasi-fazisban,Folyékony műtrágya a virágzási fázisban,"<p>A Folyékony Trágya a Virágzási Fázisra - Iron Power egy erősen koncentrált, teljes tápanyag, amely a növény virágzási fázisához készült. A Folyékony Trágya a Virágzási Fázisra - Iron Power tartalmazza az összes fontos elemet a rügyek, virágok, gyümölcsök és növények optimális fejlődéséhez. Az Adenozin-difoszfát (ADP) kiegészítésével történő azonnali energiaellátás Adenozin-trifoszfát (ATP) formájában. Serkenti a virágzási fázist Foszforral (P) és Káliummal (K). Az egyedülálló kelátolt vasformának köszönhetően ez a vasforma nem igényel energiát a növénytől. Ez az energia így teljes mértékben a virágzás javát szolgálja. Ezen kívül a Folyékony Trágya a Virágzási Fázisra - Iron Power megőrzi a levelek egészségét és zöld színét.</p>
<p>A Folyékony Trágya a Virágzási Fázisra - Iron Power egy koncentrált levél- és gyökértáp, amelyet a növekedési fázis végén és a növény virágzási fázisának első 3 hetében alkalmaznak. A Folyékony Trágya a Virágzási Fázisra - Iron Power természetes hormonokat tartalmaz a virágzás és növekedés érdekében, és növeli a levelek citokinin és klorofill tartalmát. Ez szintén növeli a cukorszintet és serkenti a klorofill termelését. Ez a trágya növeli a növény ellenálló képességét. A növény több hajtást és virágot képez, ami élénk növényt eredményez, bőséges virágzással és magas hozammal.</p>
<p>A Folyékony Trágya a Virágzási Fázisra - Iron Power nagy sikerrel alkalmazható hidroponikus és szubsztrátos termesztésben, beltéren és kültéren, mezőgazdaságban, golf- és sportpályákon, dísz- és zöldségkertekben, valamint szobanövények esetében. A Folyékony Trágya a Virágzási Fázisra - Iron Power növeli a hozamot, és biztosítja a magasabb minőséget, ízt, intenzívebb színeket és erősebb gyümölcsöket minden terményben.</p>"
gid://shopify/Collection/657054990660,buxus-vital-koncentratum,Buxus Vital koncentrátum,"<p>A Buxus Vital Koncentrátum segít a buxusoknak 100%-ban természetes módon ellenállóbbá és élénkebbé válni. Ennek eredményeként erősebb és egészségesebb buxus nő, kiegyensúlyozott és harmonikus módon. Emellett egy robusztus és élénk buxus jobban fel van készülve az olyan rovar támadásokra, mint a buxusmoly, és a buxus gombás megbetegedésekre. A Buxus Vital Koncentrátum rendkívül hatékony, serkentő és tápláló termék minden buxus számára.</p>
<p>Ez egy specifikus, természetes gyógynövény-kivonatokból álló keverék, amely biztonságos az emberek, állatok és a környezet számára. A Buxus Vital 1000 ml – Koncentrátum összetevői lassan szívódnak fel a növény és a gyökerek által, majd a nedvkeringésen keresztül eloszlanak. Ez ellenállóságot és életenergiát ad az egész buxusnak.</p>
<p>A Buxus Vital Koncentrátumot mind a teljes talajban, mind cserepekben lehet használni, a növény és a talaj meglocsolásával. A megoldás felszívódik a talajban és a növény gyökereiben. Ajánlott a növekedési időszakban kezelni, és 3 hetente megismételni. A Buxus Vital Koncentrátumot öntse az egész növényre, amíg teljesen át nem ázik. Ha bármilyen fertőzés jele van, vagy ha túlzott esőzés történt, növelje az intervallumot.</p>"
gid://shopify/Collection/657055023428,csiga-megelozes-koncentratum,Csiga megelőzés koncentrátum,"<p>A Csiga Megelőző Koncentrátum a csigák, hernyók, vadon élő állatok táplálkozása és madárcsípések okozta túlzott problémákra alkalmas. Ideális mezőgazdaságban, díszkertekben, zöldségeskertekben, cserepekben, valamint gyepfelületeken, sportpályákon és golfpályákon. A Csiga Megelőző Koncentrátum egy rendkívül koncentrált, specifikus gyógynövény-kivonatokból álló keveréket tartalmaz.</p>
<p>A megoldás természetes és növényi eredetű. A termék nem toxikus, nem marad vissza a környezetben, és nem hagy nyomokat. A Csiga Megelőző Koncentrátum közvetett elrettentő hatást gyakorol a csigákra, hernyókra, vadon élő állatokra és madarakra. A termék támogatja a növény természetes regeneráló képességét, és tápláló, erősítő hatással van a növényekre.</p>
<p>A Csiga Megelőző Koncentrátumot kifejezetten a csigák, hernyók, vadon élő állatok és madarak által okozott károk megelőzésére fejlesztették ki, de nem öli meg őket. Ez a termék 100%-ban természetes és nem tartalmaz káros anyagokat. A gyermekek, háziállatok és hasznos kertlakók számára is biztonságos! A Csiga Megelőző Koncentrátum természetes gyógynövény-kivonatokból készül. Ezek a kivonatok felszívódnak a talajban és a növényben. A gyógynövény-kivonatok ellenállóbbá teszik a növényt és környezetét a táplálkozással szemben. A kártevők nem fognak táplálkozni a kezelt növényeken, mivel a környezet nem vonzó számukra. A kártevők visszahúzódnak búvóhelyeikbe, és nem tudnak tovább fejlődni. Így a probléma természetes módon csökken.</p>
<p>A Csiga Megelőző Koncentrátum alkalmas ökológiai kertekhez. Biztonságos az emberek, állatok és a környezet számára. A természetes ragadozók, háziállatok és hasznos rovarok számára is biztonságos!</p>"
gid://shopify/Collection/657055121732,phytophthora-koncentratum,Phytophthora koncentrátum,"<p>A Phytophthora Koncentrátum kifejezetten aktív gyógynövény-kivonatokból készült, és biztonságos az emberek, állatok és a környezet számára. A termék támogatja a természetes regenerálódási képességet. Ezen kívül táplálja, eteti és erősíti a növényeket a külső hatásokkal, a talajban és a gyökereknél. Indirekt módon hat a Phytophthora ellen a burgonyában és a paradicsomban. A megoldás felszívódik a növény levelein, és erősíti a védekező rendszerét. A Phytophthora fejlődése korlátozva van, és megelőzhető.</p>"
gid://shopify/Collection/657055154500,nematodak-koncentratum,Nematódák koncentrátum,"<p>Természetesen védi a növényeket a talajban lévő különböző káros fonálférgektől, például a gyökérgöbös fonálférgektől (amelyek rózsafáradtságot okoznak), különböző negatív gyökér fonálférgektől, burgonya cisztás fonálférgektől és céklacisztás fonálférgektől.</p>
<p>A termék egy koncentrált összetételű, specifikus hatású gyógynövény-kivonatokból áll, és nem mérgező az emberekre, állatokra és a környezetre. A termék nem tartós; lebomlik a talajban, és nem hagy hátra maradványokat.</p>
<p>A Fonálféreg – Talaj Fonálféreg Koncentrátum megelőző hatást gyakorol a talajban lévő kártevőkre. Az anyagot a növény gyökerei felszívják, lehetővé téve számukra, hogy saját védekező rendszert fejlesszenek ki. A parazita fonálférgek már nem táplálkoznak a gyökerekkel. Ennek eredményeként a populáció csökken, és idővel a zavar teljesen megszűnik.</p>"
gid://shopify/Collection/657055220036,talajgombak-koncentratum,Talajgombák koncentrátum,"<p>A Talajgomba Talajgomba Koncentrátum egy erősen koncentrált, specifikus hatású gyógynövény-kivonatok keverékét tartalmazza, és megelőző hatást gyakorol a talajgombákra, mint például a verticillium (fakó betegség), pythium (palántabetegség) és fusarium (láb- és gyökérrothadás). A termék támogatja a természetes regenerálódási képességet, gondoskodást, táplálást biztosít, és megerősíti a növényeket a külső hatásokkal szemben, a talajban és a gyökereknél. A Talajgomba Talajgomba Koncentrátum természetes és növényi eredetű, és nem mérgező az emberekre, állatokra és a környezetre.</p>
<p>Bio- és ökológiai kertészetben is engedélyezett. A Talajgomba Talajgomba Koncentrátum a növény levelein és a talajon keresztül szívódik fel. A jelen lévő gyökérserkentő és növénygondozó összetevőknek köszönhetően a gyökerek, levelek és a talaj megnövekedett ellenállóságot és saját védekező rendszert fejlesztenek ki. A termék összetevői a talaj javítása és a növények megerősítése mellett közvetett hatást gyakorolnak a káros talajgombákra.</p>"
gid://shopify/Collection/657055252804,fu-rovarkoncentratum,Fű rovarkoncentrátum,"<p>A Fűrovarok Koncentrátumának közvetett riasztó hatása van a cserebogár lárvák (például májusi bogár, júniusi bogár, rózsabogár, sallandibogár stb.), a bőrgyümölcs lárvák (a darázslárva) és a sciárid lárvák jelenlétére a fűben. A Fűrovarok Koncentrátuma a fű gyökerei és levelei által is felszívódik. Növeli a fű ellenállóképességét, lehetővé téve, hogy a növény lényegében saját védekező mechanizmust fejlesszen ki. A talaj is pozitívan részesül. A növény gyökerei stimulálódnak, elősegítve az egészséges fűnövekedést. A cserebogár lárvák, a bőrgyümölcs lárvák és más káros lárvák elkerülik a növényeket. Ezek a kártevők már nem találják vonzónak a gyökereket és leveleket. Megelőző használat mellett a bőrgyümölcs lárvák, cserebogár lárvák és sciárid lárvák nem jutnak el a bábbeli állapotba.</p>
<p>A fű egészségesebbé válik, a gyökerek újra növekedni kezdenek, és kevésbé vonzóvá válnak a kártevők számára. A Fűrovarok Koncentrátuma kifejezetten a cserebogár lárvák, bőrgyümölcs lárvák és sciárid lárvák ellen lett kifejlesztve gyepben, fűterületeken és sportpályákon. A termék specifikusan aktív gyógynövény-kivonatokból áll, és közvetett megelőző szerepet játszik a talajrovarok elriasztásában. Támogatja a természetes regenerálódási képességet, ápolja, táplálja és erősíti a növényeket a külső hatásokkal, a talajban és a gyökereknél. A Fűrovarok Koncentrátuma természetes és növényi eredetű, nem mérgező az emberekre, állatokra és a környezetre, és alkalmas az ökologikus kertészkedéshez.</p>"
gid://shopify/Collection/657055318340,talaj-rovarok-koncentratum,Talaj rovarok koncentrátum,"<p>Az Organifer Talajrovarok Koncentrátum specifikus hatású gyógynövény-kivonatokból áll, és megelőző hatást gyakorol a talajrovarokra. Ez a termék támogatja a természetes regeneráló képességet, és tápláló, tápláló és növényerősítő hatásokat biztosít a külső hatások ellen, a talajban és a gyökereknél. Az Organifer Talajrovarok Koncentrátum természetes és növényi eredetű, biztonságos az emberek, állatok és a környezet számára. Különösen alkalmas az organikus kerthez. Ez a természetes megoldás megelőző funkciót kínál a dróthernyók (kattogó bogarak), talajhernyók (molyok), szőlőbogarak (orrbogarak), gyémánt- és kéregbogarak lárvái, zöldséglegyek, gyökérfúrók, szimfíliák és más káros rovarok ellen a talajban.</p>
<p>Az Organifer Talajrovarok Koncentrátumot a növény, cserje vagy fa gyökerei és levelei szívják fel, megváltoztatva a növény illatát és ízét. Ez a változás csak a rovarok számára észlelhető. A növény rezilienciájának növelésével lényegében saját védekező rendszerét fejleszti ki. A káros talajrovarok elkerülik a növényt, és abbahagyják annak fogyasztását. Ennek következtében a szaporodásuk is megszűnik, és populációjuk jelentősen csökken. Így a zavarok és károk természetesen csökkennek.</p>"
gid://shopify/Collection/657055678788,level-rovarok-koncentratum,Levél rovarok koncentrátum,"<p>A Levélrovarok Koncentrátum közvetve és megelőzően hat a természetes támadók, például a levéltetvek, pajzstetvek, gyökérlevéltetvek, gyapjastetvek, gyapjas pajzstetvek, fehér legyek, hernyók (beleértve a buxusmoly hernyókat), szőlőlegyek, liliombogarak, gubacsdarazsak, atkákat, feketeflyok, póréhagyma molykák, fekete babalevéltetvek, epervirág bogarak és levélugrók ellen.</p>
<p>A készítményt a növények, cserjék vagy fák levelei szívják fel. A reziliencia növekedésével a növény, úgy mond, kifejleszti saját védekező rendszerét ezen felszívódás révén. A szívó- és rágólevéltetvek eltűnnek, mert nem kedvelik az ételt. Más rovarokat nem érintenek. Így a problémák és károk természetesen eltűnnek.</p>
<p>A Levélrovarok Koncentrátum egy nagyon koncentrált, specifikus hatású gyógynövény-kivonatokból álló keverék. A termék természetes növényi eredetű és nem mérgező az emberekre, állatokra és a környezetre. A Levélrovarok Koncentrátumot permetezéssel lehet alkalmazni díszkertben, zöldségkertben, valamint teraszon vagy erkélyen. Az ehető növények biztonságosan fogyaszthatók.</p>"
